index,published,keyword,domain,language,valid,title,description,url,image,archive,content,quote,de,en,la,added
4373ec15204b332350009ef44187ff3b,2025-11-03T04:06:48Z,'Erdbeben',www.diepresse.com,de,1.0,"Erdbeben der Stärke 6,3 im Norden Afghanistans: Mindestens neun Tote",Das Beben war bis in die hunderte Kilometer entfernte Hauptstadt Kabul zu spüren. Das Land war erst Ende August von einem schweren Erdbeben mit mehr als 2200 Todesopfern erschüttert worden.,https://www.diepresse.com/20265051/erdbeben-der-staerke-6-3-im-norden-afghanistans-mindestens-neun-tote,https://img.diepresse.com/public/incoming/klvh10-TOPSHOT-AFGHANISTAN-EARTHQUAKE/alternates/DPR_SOCIAL_NACHRICHTEN/TOPSHOT-AFGHANISTAN-EARTHQUAKE,,"Das Beben war bis in die hunderte Kilometer entfernte Hauptstadt Kabul zu spüren. Das Land war erst Ende August von einem schweren Erdbeben mit mehr als 2200 Todesopfern erschüttert worden.
Bei eine… [+2426 chars]",,"Erdbeben der Stärke 6,3 im Norden Afghanistans: Mindestens neun Tote. Das Beben war bis in die hunderte Kilometer entfernte Hauptstadt Kabul zu spüren. Das Land war erst Ende August von einem schweren Erdbeben mit mehr als 2200 Todesopfern erschüttert worden.","Magnitude 6.3 earthquake in northern Afghanistan: At least nine dead. The quake was felt as far away as the capital Kabul, hundreds of kilometers away. The country was hit by a severe earthquake at the end of August, killing more than 2,200 people.","Magnitudo 6.3 terrae motus in Afghanistan septentrionali: Saltem novem mortui. Motus usque ad caput Kabul centum chiliometrorum sensit. Terra terrae motu gravi exeunte Augusto percussa est, ut plus quam 2.200 homines interficerent.",2025-10-20 15:08:46+00:00
f7b1f7eb05fe97ca5af8a650f986a991,2025-11-03T04:25:16Z,'Erdbeben Tote',www.zeit.de,de,1.0,Afghanistan: Mindestens neun Tote bei Erdbeben in Afghanistan,In Afghanistan hat es erneut ein heftiges Erdbeben gegeben. Es war auch in der Hauptstadt Kabul zu spüren. Die medizinische Versorgung der Verletzten ist schwierig.,https://www.zeit.de/gesellschaft/zeitgeschehen/2025-11/afghanistan-erdbeben-samangan-kabul,https://img.zeit.de/gesellschaft/zeitgeschehen/2025-11/afghanistan-erdbeben-samangan-kabul-bild-2/wide__1300x731,,"Bei einem Erdbeben der Stärke 6,3 im Norden Afghanistans sind nach Behördenangaben mindestens neun Menschen gestorben. In der Provinz Samangan seien fünf Menschen getötet und mehr als 140 Menschen ve… [+1198 chars]",,Afghanistan: Mindestens neun Tote bei Erdbeben in Afghanistan. In Afghanistan hat es erneut ein heftiges Erdbeben gegeben. Es war auch in der Hauptstadt Kabul zu spüren. Die medizinische Versorgung der Verletzten ist schwierig.,Afghanistan: At least nine dead in earthquake in Afghanistan. There has been another violent earthquake in Afghanistan. It was also felt in the capital Kabul. Medical care for the injured is difficult.,Afghanistan: Saltem novem mortui terrae motu in Afghanistan. Alter motus violentus in Afghanistan fuit. Hoc etiam in copheta capitali sentiebatur. Medicorum cura laesa difficilis est.,2025-10-20 15:08:46+00:00
bf4448baad4c314024ed80978748d619,2025-11-03T04:40:47Z,'Erdbeben Tote',www.stern.de,de,1.0,"Mindestens neun Tote bei Erdbeben der Stärke 6,3 im Norden Afghanistans","Bei einem Erdbeben der Stärke 6,3 im Norden Afghanistans sind nach Behördenangaben mindestens neun Menschen ums Leben gekommen. In der Provinz Samangan seien fünf Menschen getötet worden, teilte die afghanische Katastrophenschutzbehörde am Montag mit. In der …",https://www.stern.de/news/mindestens-neun-tote-bei-erdbeben-der-staerke-6-3-im-norden-afghanistans-36182972.html,https://image.stern.de/36182974/t/5d/v1/w1440/r1.7778/-/03--verletzte-werden-nach-erdbeben-in-einem-krankenhaus-versorgt---79b61f3217d475d4.jpg,,"Kopiere den aktuellen Link
Zur Merkliste hinzufügen
Bei einem Erdbeben der Stärke 6,3 im Norden Afghanistans sind nach Behördenangaben mindestens neun Menschen ums Leben gekommen. In der Provinz Sa… [+2134 chars]",,"Mindestens neun Tote bei Erdbeben der Stärke 6,3 im Norden Afghanistans. Bei einem Erdbeben der Stärke 6,3 im Norden Afghanistans sind nach Behördenangaben mindestens neun Menschen ums Leben gekommen. In der Provinz Samangan seien fünf Menschen getötet worden, teilte die afghanische Katastrophenschutzbehörde am Montag mit. In der …","At least nine dead in magnitude 6.3 earthquake in northern Afghanistan. According to authorities, at least nine people died in a magnitude 6.3 earthquake in northern Afghanistan. The Afghan disaster management agency said on Monday that five people were killed in Samangan province. In the …","Saltem novem mortui in magnitudine 6.3 terrae motus in Afghanistan septentrionali. Secundum auctores, saltem novem homines in magnitudine 6.3 terrae motus in Afghanistan septentrionali mortui sunt. In administratione calamitatis Afghan procurationis die Lunae dixit quinque homines in provincia Samangan occisos esse. In ...",2025-10-20 15:08:46+00:00
3ff01a417c2817d896b293e36c59fbcf,2025-11-03T05:22:55Z,'Erdbeben Trümmer',www.zeit.de,de,1.0,Katastrophe: Tote bei Erdbeben in Afghanistan,Hier finden Sie Informationen zu dem Thema „Katastrophe“. Lesen Sie jetzt „Tote bei Erdbeben in Afghanistan“.,https://www.zeit.de/news/2025-11/03/tote-bei-erdbeben-in-afghanistan,https://img.zeit.de/news/2025-11/03/tote-bei-erdbeben-in-afghanistan-image-group/wide__1300x731,,Bei einem Erdbeben im Norden Afghanistans sind nach Angaben der staatlichen Nachrichtenagentur Bachtar mindestens 8 Menschen ums Leben gekommen und über 180 verletzt worden. Die Zahl der Opfer könnte… [+522 chars],,Katastrophe: Tote bei Erdbeben in Afghanistan. Hier finden Sie Informationen zu dem Thema „Katastrophe“. Lesen Sie jetzt „Tote bei Erdbeben in Afghanistan“.,Disaster: Deaths in earthquake in Afghanistan. Here you will find information on the topic of “catastrophe”. Now read “Dead in Afghanistan earthquake”.,"Calamitas: Mortes terrae motu in Afghanistan. Hic informationes invenies in argumento ""casstrophe"". Nunc legitur ""Mortuus terrae motu in Afghanistan"".",2025-10-20 15:08:46+00:00
dcca40b72a48f6d2519c77c60b2fc1f6,2025-11-03T05:22:55Z,'Erdbeben Tote',www.stern.de,de,1.0,Katastrophe: Tote bei Erdbeben in Afghanistan,Kabul - Bei einem Erdbeben im Norden Afghanistans sind nach Angaben der staatlichen Nachrichtenagentur Bachtar mindestens 8 Menschen ums Leben gekommen,https://www.stern.de/panorama/katastrophe--tote-bei-erdbeben-in-afghanistan-36183024.html,https://image.stern.de/36183026/t/PO/v1/w1440/r1.7778/-/03--vndvr2kbx5v5axs2048jpeg---2df38bb1a9f267ec.jpg,,"Kopiere den aktuellen Link
Zur Merkliste hinzufügen
Im Norden Afghanistans bebte am späten Sonntagabend die Erde. Die staatliche Nachrichtenagentur Bachtar spricht von mehreren Toten.
Bei einem Er… [+669 chars]",,Katastrophe: Tote bei Erdbeben in Afghanistan. Kabul - Bei einem Erdbeben im Norden Afghanistans sind nach Angaben der staatlichen Nachrichtenagentur Bachtar mindestens 8 Menschen ums Leben gekommen,"Disaster: Deaths in earthquake in Afghanistan. Kabul - An earthquake in northern Afghanistan has killed at least 8 people, according to the state news agency Bakhtar","Calamitas: Mortes terrae motu in Afghanistan. Kabul - Terrae motus in Afghanistan septentrionali saltem octo homines occidit, secundum statum nuntium agentis Bakhtar",2025-10-20 15:08:46+00:00
b44fe65a9b66ccc4092c9f82838d74de,2025-11-03T05:24:14Z,'Erdbeben Trümmer',www.tagesspiegel.de,de,1.0,Katastrophe: Tote bei Erdbeben in Afghanistan,Im Norden Afghanistans bebte am späten Sonntagabend die Erde. Die staatliche Nachrichtenagentur Bachtar spricht von mehreren Toten.,https://www.tagesspiegel.de/gesellschaft/panorama/katastrophe-tote-bei-erdbeben-in-afghanistan-14728313.html,https://www.tagesspiegel.de/images/14728310/alternates/BASE_16_9_W1400/1762147453000/erdbeben-in-afghanistan.jpeg,,Bei einem Erdbeben im Norden Afghanistans sind nach Angaben der staatlichen Nachrichtenagentur Bachtar mindestens 8 Menschen ums Leben gekommen und über 180 verletzt worden. Die Zahl der Opfer könnte… [+576 chars],,Katastrophe: Tote bei Erdbeben in Afghanistan. Im Norden Afghanistans bebte am späten Sonntagabend die Erde. Die staatliche Nachrichtenagentur Bachtar spricht von mehreren Toten.,Disaster: Deaths in earthquake in Afghanistan. The earth shook in northern Afghanistan late on Sunday evening. The state news agency Bachtar speaks of several deaths.,Calamitas: Mortes terrae motu in Afghanistan. Terra in septentrionali Afghanistan sero die dominico vesperi commota est. Status nuntiorum procurationis Bachtar de pluribus mortibus loquitur.,2025-10-20 15:08:46+00:00
f85f21bd76518a62182dbd3b995ea3fb,2025-11-03T05:49:48Z,'Erdbeben',www.nzz.ch,de,1.0,Weiteres Erdbeben in Afghanistan: Mindestens 20 Tote,Im Norden Afghanistans zitterte am späten Sonntagabend erneut die Erde. Erst im September waren bei einem Beben mehr als 2000 Personen ums Leben gekommen.,https://www.nzz.ch/panorama/weiteres-erdbeben-in-afghanistan-mindestens-20-tote-ld.1909977,"https://img.nzz.ch/2025/11/03/16ec8397-eaf1-40e4-87e2-ded181e10949.jpg?width=1200&height=675&fit=bounds&quality=75&auto=webp&crop=5568,3132,x0,y294&wmark=nzz",,"Im Norden Afghanistans zitterte am späten Sonntagabend erneut die Erde. Erst im September waren bei einem Beben mehr als 2000 Personen ums Leben gekommen.
03.11.2025, 06.49 Uhr
Das Erdbeben der Stä… [+956 chars]",,Weiteres Erdbeben in Afghanistan: Mindestens 20 Tote. Im Norden Afghanistans zitterte am späten Sonntagabend erneut die Erde. Erst im September waren bei einem Beben mehr als 2000 Personen ums Leben gekommen.,"Another earthquake in Afghanistan: at least 20 dead. The earth shook again late on Sunday evening in northern Afghanistan. Just in September, more than 2,000 people died in an earthquake.","Alius terrae motus in Afghanistan: saltem mortuus XX. Sero die dominico vesperi in septentrionem Afghanistan terra commota est. Iusto mense Septembri plus quam 2,000 homines terrae motu mortui sunt.",2025-10-20 15:08:46+00:00
671edb8175623b194551beb26a387308,2025-11-03T07:02:03Z,'Erdbeben',www.stern.de,de,1.0,Mehr als 20 Tote bei Beben in Afghanistan - Blaue Moschee in Masar-i-Scharif beschädigt,"Nach dem schweren Erdbeben im Norden Afghanistans hat sich die Opferzahl weiter erhöht. In den Provinzen Samangan und Balch seien mehr als 20 Menschen ums Leben gekommen, teilte das Gesundheitsministerium der regierenden Taliban am Montag mit. Zudem gebe es r…",https://www.stern.de/news/mehr-als-20-tote-bei-beben-in-afghanistan---blaue-moschee-in-masar-i-scharif-beschaedigt-36183050.html,https://image.stern.de/36183148/t/tO/v1/w1440/r1.7778/-/03--blaue-moschee-in-masarischarif---df15472e72a1dac2.jpg,,"Kopiere den aktuellen Link
Zur Merkliste hinzufügen
Nach dem schweren Erdbeben im Norden Afghanistans hat sich die Opferzahl weiter erhöht. In den Provinzen Samangan und Balch seien mehr als 20 Men… [+1949 chars]",,"Mehr als 20 Tote bei Beben in Afghanistan - Blaue Moschee in Masar-i-Scharif beschädigt. Nach dem schweren Erdbeben im Norden Afghanistans hat sich die Opferzahl weiter erhöht. In den Provinzen Samangan und Balch seien mehr als 20 Menschen ums Leben gekommen, teilte das Gesundheitsministerium der regierenden Taliban am Montag mit. Zudem gebe es r…","More than 20 dead in earthquake in Afghanistan - Blue Mosque in Mazar-i-Sharif damaged. After the severe earthquake in northern Afghanistan, the number of victims has continued to rise. More than 20 people were killed in the provinces of Samangan and Balkh, the ruling Taliban's health ministry said on Monday. There are also...","Plus quam XX mortui terrae motu in Afghanistan - Blue Mosque in Mazar-i-Sharif vexati sunt. Post graves terrae motus in Afghanistan septentrionali numerus victimarum surgere continuavit. Plus quam XX homines in provinciis Samangan et Bactra interfecti sunt, qui praesidens Taliban ministerium sanitatis die Lunae dixit. Sunt etiam...",2025-10-20 15:08:46+00:00
1c97bcbf59860ccf7b1fd8300c73c0be,2025-11-03T08:12:11Z,'Erdbeben Verletzte',www.morgenpost.de,de,1.0,Schweres Erdbeben erschüttert Afghanistan – mehr als 20 Tote,Erneut bebte in dem von den Taliban regierten Land die Erde – diesmal im Norden. Behörden melden Hunderte Verletzte und viele Tote.,https://www.morgenpost.de/panorama/article410365217/schweres-erdbeben-erschuettert-afghanistan-mehr-als-20-tote.html,https://img.sparknews.funkemedien.de/410132904/410132904_1759321683_v16_9_1600.jpeg,,"Erneut hat in Afghanistan die Erde gebebt diesmal im Norden. In den Provinzen Samangan und Balch seien mehr als 20 Menschen ums Leben gekommen, teilte das Gesundheitsministerium der regierenden Talib… [+1979 chars]",,Schweres Erdbeben erschüttert Afghanistan – mehr als 20 Tote. Erneut bebte in dem von den Taliban regierten Land die Erde – diesmal im Norden. Behörden melden Hunderte Verletzte und viele Tote.,Severe earthquake shakes Afghanistan – more than 20 dead. The earth shook again in the country ruled by the Taliban - this time in the north. Authorities report hundreds of injuries and many deaths.,Gravis terrae motus Afghanistan - plus quam XX mortuus est. Terra commota est iterum in regione Taliban regente - hoc tempore in aquilone. Auctoritates centum iniurias et multas mortes referunt.,2025-10-20 15:08:46+00:00
2682192b6a97b05c899b606537853f82,2025-11-03T08:39:00Z,'Erdbeben Tote',www.dw.com,de,1.0,Schweres Erdbeben erschüttert Norden von Afghanistan,Wieder bebt in dem Land am Hindukusch die Erde. Und wieder gibt es nach Angaben der in Afghanistan herrschenden Taliban viele Tote und Verletzte. Besonders betroffen von dem Erdbeben sind die Provinzen Samangan und Balch in Afghanistan. Insgesamt seien dort m…,https://www.dw.com/de/masar-i-scharif-erdbeben-blaue-moschee-afghanistan-tote-verletzte-taliban/a-74593516,https://static.dw.com/image/74593022_6.jpg,,"Besonders betroffen von dem Erdbeben sind die Provinzen Samangan und Balch in Afghanistan. Insgesamt seien dort mehr als 20 Menschen ums Leben gekommen, teilte das Gesundheitsministerium der islamist… [+1722 chars]",,Schweres Erdbeben erschüttert Norden von Afghanistan. Wieder bebt in dem Land am Hindukusch die Erde. Und wieder gibt es nach Angaben der in Afghanistan herrschenden Taliban viele Tote und Verletzte. Besonders betroffen von dem Erdbeben sind die Provinzen Samangan und Balch in Afghanistan. Insgesamt seien dort m…,"Severe earthquake shakes northern Afghanistan. The earth is shaking again in the country on the Hindu Kush. And again, according to the Taliban ruling Afghanistan, there are many dead and injured. The provinces of Samangan and Balkh in Afghanistan are particularly affected by the earthquake. Overall, there are…","Gravis terrae motus Afghanistan septentrionalem quatit. Terra rursus in regione in Prohibeo Kush quatitur. Et iterum, secundum Taliban regnante Afghanistan, multi mortui sunt et vulnerati. Provinciae Samangan et Bactra in Afghanistan terrae motu praecipue afficiuntur. Super, sunt…",2025-10-20 15:08:46+00:00
05d715e52ea8c4742b55fe5ca581f9e6,2025-11-03T11:38:44Z,'Erdbeben Rettungskräfte',www.stern.de,de,1.0,Katastrophe: Erdbeben erschüttert Afghanistan - Mehr als 20 Tote,Kabul - Bei einem schweren Erdbeben im Norden Afghanistans sind mindestens 27 Menschen ums Leben gekommen. Das meldete die staatliche Nachrichtenagentur,https://www.stern.de/panorama/katastrophe--erdbeben-erschuettert-afghanistan---mehr-als-20-tote-36183964.html,https://image.stern.de/36183966/t/Fk/v1/w1440/r1.7778/-/03--atbalnooxpv4axs2048jpeg---9126ae70b5117156.jpg,,"Kopiere den aktuellen Link
Zur Merkliste hinzufügen
Nach dem schweren Erdbeben in Nordafghanistan steigt die Opferzahl weiter. Zudem kam es zu zahlreichen Schäden. Was ist bekannt?

Bei einem schwe… [+1854 chars]",,Katastrophe: Erdbeben erschüttert Afghanistan - Mehr als 20 Tote. Kabul - Bei einem schweren Erdbeben im Norden Afghanistans sind mindestens 27 Menschen ums Leben gekommen. Das meldete die staatliche Nachrichtenagentur,Catastrophe: Earthquake shakes Afghanistan - More than 20 dead. Kabul - At least 27 people have died in a severe earthquake in northern Afghanistan. This was reported by the state news agency,Catastrophe: Terrae motus Afghanistan quatit - Plus quam XX mortuus est. Kabul - Saltem XXVII homines in gravi terrae motu in Afghanistan septentrionali mortui sunt. Haec relata per publica nuntium propellente,2025-10-20 15:08:46+00:00
88d4d89cafa64c6dae701ad9cbb0b2eb,2025-11-03T11:38:44Z,'Erdbeben',www.zeit.de,de,1.0,Katastrophe: Erdbeben erschüttert Afghanistan - Mehr als 20 Tote,Hier finden Sie Informationen zu dem Thema „Katastrophe“. Lesen Sie jetzt „Erdbeben erschüttert Afghanistan - Mehr als 20 Tote“.,https://www.zeit.de/news/2025-11/03/erdbeben-erschuettert-afghanistan-mehr-als-20-tote,https://img.zeit.de/news/2025-11/03/erdbeben-erschuettert-afghanistan-mehr-als-20-tote-image-group/wide__1300x731,,Bei einem schweren Erdbeben im Norden Afghanistans sind mindestens 27 Menschen ums Leben gekommen. Das meldete die staatliche Nachrichtenagentur Bachtar. Zudem seien 730 Menschen verletzt worden. Am … [+1710 chars],,Katastrophe: Erdbeben erschüttert Afghanistan - Mehr als 20 Tote. Hier finden Sie Informationen zu dem Thema „Katastrophe“. Lesen Sie jetzt „Erdbeben erschüttert Afghanistan - Mehr als 20 Tote“.,Catastrophe: Earthquake shakes Afghanistan - More than 20 dead. Here you will find information on the topic of “catastrophe”. Now read “Earthquake shakes Afghanistan – More than 20 dead”.,"Catastrophe: Terrae motus Afghanistan quatit - Plus quam XX mortuus est. Hic informationes invenies in argumento ""casstrophe"". Nunc lege “Terræ motus Afghanistan concutit – Plus quam XX mortuus est”.",2025-10-20 15:08:46+00:00
bbc69a2c157219d251a4fff595a756ed,2025-11-08T12:05:22Z,'Erdbeben Verwerfung',www.bild.de,de,0.9,Unterseekabel als Lebensretter - Wie Glasfaser künftig Erdbeben erkennen kann,EU-Projekt nutzt Glasfaserkabel zur Echtzeit-Überwachung von Erdbeben und Tsunamis.,https://www.bild.de/leben-wissen/wissenschaft/netzwerk-im-meer-glasfaserkabel-kann-naturkatastrophen-vorhersagen-690ef3bf0166cd59ef998b23,"https://images.bild.de/690ef3bf0166cd59ef998b23/9e581b518026f573260bc072b2312139,e56a4684?w=1280",,"Durch die Meere zieht sich ein Netz: Rund 1,48 Millionen Kilometer Glasfaserkabel transportieren dort fast den gesamten Internet- und Telefonverkehr der Welt. Diese Datenleitungen könnten bald noch v… [+2181 chars]",,Unterseekabel als Lebensretter - Wie Glasfaser künftig Erdbeben erkennen kann. EU-Projekt nutzt Glasfaserkabel zur Echtzeit-Überwachung von Erdbeben und Tsunamis.,Submarine cables as a lifesaver - How fiber optics can detect earthquakes in the future. EU project uses fiber optic cables for real-time monitoring of earthquakes and tsunamis.,Funes subaquanei quasi vitatoris - Quomodo fibra perspectiva deprehendere possunt terrae motus in futuro. UE project utitur funibus opticis fibris pro magna terrae motuum et tsunamis reali tempore.,2025-11-20 09:16:26+00:00
569815aaadd3dcc0963998036595e5f4,2025-11-03T11:22:30Z,'Erdbeben Überlebende',www.stern.de,de,0.9,Erdbeben,"In einem Dorf im Nordosten Afghanistans sitzt ein Überlebender auf den Ruinen eines zerstörten Hauses. Die Region wurde am späten Sonntagabend von einem Erdbeben der Stärke 6,3 getroffen. Mehr als 20 Menschen kamen dabei ums Leben.",https://www.stern.de/news/erdbeben-36183908.html,https://image.stern.de/36183910/t/pm/v1/w1440/r1.7778/-/03--erdbeben---64d866c7cc080a21.jpg,,"Zugang zu stern+statt 11,96 
 nur 1  
<ul><li>Alles von stern+ mit erstklassigen Inhalten von GEO und Capital</li><li>4 Wochen testen, dann 2,99  je Woche</li><li>jederzeit kündbar</li></ul>",,"Erdbeben. In einem Dorf im Nordosten Afghanistans sitzt ein Überlebender auf den Ruinen eines zerstörten Hauses. Die Region wurde am späten Sonntagabend von einem Erdbeben der Stärke 6,3 getroffen. Mehr als 20 Menschen kamen dabei ums Leben.","Earthquake. In a village in northeastern Afghanistan, a survivor sits on the ruins of a destroyed house. The region was hit by a magnitude 6.3 earthquake late Sunday evening. More than 20 people were killed.","Terrae motus. In vico Afghanistan septentrionali ad orientem, superstes in ruinis domus dirutae sedet. Regio magnitudine 6.3 terrae motu sero die dominico vesperi ictus est. Plus XX homines interfecti sunt.",2025-11-21 05:46:29+00:00
cf1fcb8adf5b1a3a383924372cbdf711,2025-11-03T12:52:47Z,'Erdbeben',www.n-tv.de,de,0.9,Person in den Trümmern : Teil von historischem Turm in Rom bei Bauarbeiten eingestürzt,Bereits seit 1203 prägt der Torre dei Conti das Stadtbild von Rom. Doch über die Jahrhunderte nimmt das Bauwerk bei Erdbeben immer wieder Schaden. Bei Renovierungsarbeiten stürzt ein Teil des Gebäudes am Vormittag ein.,https://www.n-tv.de/panorama/Historischer-Turm-Torre-dei-Conti-in-Rom-stuerzt-bei-Bauarbeiten-teilweise-ein-article26137688.html,https://www.n-tv.de/img/incoming/crop26137675/6021325115-cImg_16_9-w1200/556388984.jpg,,Bereits seit 1203 prägt der Torre dei Conti das Stadtbild von Rom. Doch über die Jahrhunderte nimmt das Bauwerk bei Erdbeben immer wieder Schaden. Bei Renovierungsarbeiten stürzt ein Teil des Gebäude… [+1989 chars],,Person in den Trümmern : Teil von historischem Turm in Rom bei Bauarbeiten eingestürzt. Bereits seit 1203 prägt der Torre dei Conti das Stadtbild von Rom. Doch über die Jahrhunderte nimmt das Bauwerk bei Erdbeben immer wieder Schaden. Bei Renovierungsarbeiten stürzt ein Teil des Gebäudes am Vormittag ein.,"Person in the rubble: Part of historic tower in Rome collapsed during construction work. The Torre dei Conti has shaped the cityscape of Rome since 1203. But over the centuries, the building was repeatedly damaged by earthquakes. During renovation work, part of the building collapsed in the morning.","Persona in ruderibus: Pars turris historicae Romae in opere constructionis corruit. Torre dei Conti urbem Romam ab anno 1203 efformavit. Sed per saecula, aedificium saepe terrae motibus laesum est. In renovatione operis, pars aedificii mane concidit.",2025-11-21 05:46:29+00:00
5cb4fb808f6a8ac6431748cfb5b90203,2025-11-09T09:48:54Z,'Erdbeben',www.welt.de,de,0.9,"Japan gibt nach Seebeben der Stärke 6,7 Tsunami-Warnung aus",Vor der Ostküste Japans hat sich ein stärkeres Erdbeben ereignet. Die Behörden warnen deshalb vorsichtshalber vor möglichen Tsunami-Wellen. Betroffene Küstenbewohner wurden aufgerufen fernzubleiben.,https://www.welt.de/vermischtes/article69105b614fb7cf683f37a0a2/katastrophenschutz-japan-gibt-nach-seebeben-der-staerke-6-7-tsunami-warnung-aus.html,https://images.welt.de/69105b614fb7cf683f37a0a2/187a2835c0f5390a26c8cc6d6f3cf963-master/ci16x9-w1200/395676547-jpg,,"Nach einem Seebeben der Stärke 6,7 vor der Küste Japans haben die japanischen Behörden eine Tsunami-Warnung ausgesprochen. Der mögliche Tsunami könne eine Höhe von bis zu einem Meter erreichen, erklä… [+1049 chars]",,"Japan gibt nach Seebeben der Stärke 6,7 Tsunami-Warnung aus. Vor der Ostküste Japans hat sich ein stärkeres Erdbeben ereignet. Die Behörden warnen deshalb vorsichtshalber vor möglichen Tsunami-Wellen. Betroffene Küstenbewohner wurden aufgerufen fernzubleiben.",Japan issues tsunami warning after magnitude 6.7 earthquake. A stronger earthquake occurred off the east coast of Japan. The authorities are therefore warning of possible tsunami waves as a precaution. Affected coastal residents were asked to stay away.,Iaponia quaestiones tsunami observavit post magnitudinem 6.7 terrae motus. Validior terrae motus factus est ad oram Iaponiae orientalem. Auctoritates igitur monentes de tsunami fluctibus fieri ad cautelam. Incolas maritimos affectos rogatos ut discedant.,2025-11-21 05:46:29+00:00
37d266a825f0608989a166b862f12316,2025-11-12T14:54:34Z,'Erdbeben',www.diepresse.com,de,0.9,Erdbeben während ÖFB-Training in Paphos,"Nicht alle Spieler bekamen das Beben der Stärke 5,3 mit. „Bei manchen raschelt es sowieso im Kopf“, meinte etwa Christoph Baumgartner.",https://www.diepresse.com/20298507/erdbeben-waehrend-oefb-training-in-paphos,https://img.diepresse.com/public/incoming/467znu-GEPA-20251112-101-142-0016/alternates/DPR_SOCIAL_NACHRICHTEN/GEPA-20251112-101-142-0016,,"Nicht alle Spieler bekamen das Beben der Stärke 5,3 mit. Bei manchen raschelt es sowieso im Kopf, meinte etwa Christoph Baumgartner.
Während des Mittwoch-Trainings der österreichischen Fußball-Natio… [+1089 chars]",,"Erdbeben während ÖFB-Training in Paphos. Nicht alle Spieler bekamen das Beben der Stärke 5,3 mit. „Bei manchen raschelt es sowieso im Kopf“, meinte etwa Christoph Baumgartner.","Earthquake during ÖFB training in Paphos. Not all players felt the 5.3 magnitude quake. “Some people's heads are rustling anyway,” said Christoph Baumgartner.","Motus in FB disciplina Paphi. Non omnes histriones senserunt 5.3 magnitu- dine commoti. ""Quaedam capita usquam crepitant"", Christoph Baumgartner dixit.",2025-11-21 05:46:29+00:00
387588237e1b1eb35792964a4ef89e45,2025-11-12T15:34:45Z,'Erdbeben',orf.at,de,0.9,Zwei starke Erdbeben erschüttern Zypern,,https://orf.at/stories/3411337/,https://orf.at/mojo/1_4_1/storyserver//news/common/images/og-fallback-news.png,,AufZypern hat heute zweimal stark die Erde gebebt. Das Zentrum der Erdstöße lag rund 25 Kilometer nordöstlich der Touristenhochburg Paphos. Die schweren Erschütterungen waren auf der gesamten Insel u… [+828 chars],,Zwei starke Erdbeben erschüttern Zypern. None,Two strong earthquakes hit Cyprus. None,Duo terrae motus validi Cyprum feriunt. Nullus,2025-11-21 05:46:29+00:00
