index,published,keyword,domain,language,valid,title,description,url,image,archive,content,quote,de,en,la,added
e458943905934a089056e338f12eab86,2025-11-13T08:39:35Z,'Erdbeben',www.morgenpost.de,de,0.9,Starke Erdbeben erschüttern Zypern – weitere könnten folgen,"Schulen wurden vorsorglich geräumt: Zypern ist von zwei Erdbeben erschüttert worden. Unklar ist, ob noch weitere Beben folgen.",https://www.morgenpost.de/panorama/article410446161/starke-erdbeben-erschuettern-zypern-weitere-koennten-folgen.html,https://img.sparknews.funkemedien.de/410446167/410446167_1763019129_v16_9_1600.jpeg,,Auf Zypern hat am Mittwoch zweimal stark die Erde gebebt. Das Zentrum der Erdstöße lag rund 25 Kilometer nordöstlich der Touristenhochburg Paphos. Die schweren Erschütterungen waren auf der gesamten … [+1020 chars],,"Starke Erdbeben erschüttern Zypern – weitere könnten folgen. Schulen wurden vorsorglich geräumt: Zypern ist von zwei Erdbeben erschüttert worden. Unklar ist, ob noch weitere Beben folgen.",Strong earthquakes shake Cyprus - more could follow. Schools were evacuated as a precaution: Cyprus was shaken by two earthquakes. It is unclear whether further quakes will follow.,Magni terrae motus Cyprum concutiunt - plura sequi potuerunt. Scholae ad cautelam decesserunt: Cyprum duobus terrae motibus concussa est. Incertum est an sequetur porro mota.,2025-11-21 05:46:29+00:00
972eb4f28d0ce397687f2578bd518f5f,2025-11-13T10:48:45Z,'Erdbeben',www.sueddeutsche.de,de,0.9,Prozess um Zugunglück bei Garmisch: Lokführer über Streckenzustand: „Da kann ich alle zwei Kilometer was melden“,"Im Prozess um das Zugunglück von Garmisch-Partenkirchen schildert der Lokführer, wie er das Unglück erlebt hat. „Wie ein Erdbeben“, sagt er – und wirft mit seiner Aussage ein weiteres Schlaglicht auf die Zustände bei der Bahn.",https://www.sueddeutsche.de/bayern/garmisch-partenkirchen-zugunglueck-bahn-prozess-lokfuehrer-aussage-li.3338225,https://www.sueddeutsche.de/2025/11/13/071e042c-878a-4af2-9724-7388a85ec356.jpg?q=60&fm=webp&width=1200&rect=0%2C109%2C4000%2C2250,,"Plötzlich habe sein Fahrzeug einen Schlag nach rechts, einen Schlag nach links gemacht. Das habe ihm im Prinzip den Sitz unterm Arsch weggezogen. Es gab eine Riesen-Staubwolke, sagte der Mann. Dann h… [+1672 chars]",,"Prozess um Zugunglück bei Garmisch: Lokführer über Streckenzustand: „Da kann ich alle zwei Kilometer was melden“. Im Prozess um das Zugunglück von Garmisch-Partenkirchen schildert der Lokführer, wie er das Unglück erlebt hat. „Wie ein Erdbeben“, sagt er – und wirft mit seiner Aussage ein weiteres Schlaglicht auf die Zustände bei der Bahn.","Train accident trial near Garmisch: Train driver about the condition of the route: “I can report something every two kilometers”. In the trial surrounding the train accident in Garmisch-Partenkirchen, the train driver describes how he experienced the accident. “Like an earthquake,” he says – and with his statement sheds further light on the conditions at the railway.","Trainine casus iudicii prope Garmisch: Exerce exactoris de condicione itineris: ""Aliquid referre possum duo chiliometra"". In iudicio circumiecto traminis casus in Garmisch-Partenkirchen, aurigae tramen describit quomodo casus expertus est. “Sicut terrae motus,” inquit, et cum sententia sua condiciones ferriviarias adhuc inluminat.",2025-11-21 05:46:29+00:00
94fe83310772ce8cc1d895b0ca5ffc68,2025-11-14T09:47:15Z,'Erdbeben',www.visions.de,de,0.9,AC/DC lösen Erdbeben in Melbourne aus,"Bei ihrer ersten Show seit zehn Jahren in Australien haben AC/DC ein Erdbeben ausgelöst. Auch in kilometerweiter Entfernung soll die Show zu hören gewesen sein.
Der Beitrag Erdbeben ausgelöst erschien zuerst auf VISIONS.de.",https://www.visions.de/news/acdc-erdbeben-ausgeloest/,https://www.visions.de/wp-content/uploads/acdclive-scaled.jpg,,"Am Mittwoch haben AC/DC erstmals seit zehn Jahren wieder ein Konzert in ihrer Heimatstadt Melbourne gespielt – mit so durchschlagendem Erfolg, dass Berichten des australischen Nachrichtensenders ABC … [+1904 chars]",,"AC/DC lösen Erdbeben in Melbourne aus. Bei ihrer ersten Show seit zehn Jahren in Australien haben AC/DC ein Erdbeben ausgelöst. Auch in kilometerweiter Entfernung soll die Show zu hören gewesen sein.
Der Beitrag Erdbeben ausgelöst erschien zuerst auf VISIONS.de.","AC/DC triggers earthquake in Melbourne. AC/DC caused an earthquake at their first show in ten years in Australia. The show can also be heard from miles away.
The post Earthquake triggered first appeared on VISIONS.de.","AC/DC triggers terrae motus in Melbourne. AC/DC in Australia decem annis primo spectaculo terrae motum effecit. Spectaculum etiam audiri potest a miliaribus distans.
Post Terraemotus Urguet primum in VISIONS.de.",2025-11-21 05:46:29+00:00
aa2b5c281a804551ed97c2114b7122a1,2025-11-21T08:34:40Z,'Erdbeben',www.diepresse.com,de,0.9,Mindestens drei Menschen sterben bei Erdbeben in Bangladesch,"Bei dem Erdbeben der Stärke 5,5 in Bangladesch sind nach Angaben der Regierung in Dhaka mindestens drei Menschen ums Leben gekommen.",https://www.diepresse.com/20328369/mindestens-drei-menschen-sterben-bei-erdbeben-in-bangladesch,https://img.diepresse.com/public/incoming/blxoou-2025-11-21T053635Z_402092439_RC2T0IA28LHJ_RTRMADP_3_BANGLADESH-QUAKE.JPG/alternates/DPR_SOCIAL_NACHRICHTEN/2025-11-21T053635Z_402092439_RC2T0IA28LHJ_RTRMADP_3_BANGLADESH-QUAKE.JPG,,"Bei dem Erdbeben der Stärke 5,5 in Bangladesch sind nach Angaben der Regierung in Dhaka mindestens drei Menschen ums Leben gekommen.
Das Erdbeben in Bangladesch, bei dem mindestens drei Personen sta… [+974 chars]",,"Mindestens drei Menschen sterben bei Erdbeben in Bangladesch. Bei dem Erdbeben der Stärke 5,5 in Bangladesch sind nach Angaben der Regierung in Dhaka mindestens drei Menschen ums Leben gekommen.","At least three people die in earthquake in Bangladesh. According to the government in Dhaka, at least three people died in the 5.5 magnitude earthquake in Bangladesh.","Saltem tres homines terrae motu in Bangladesia moriuntur. Secundum regimen in Dhaka, saltem tres homines in magnitudine terrae motus in Bangladesh 5.5 mortui sunt.",2025-11-28 23:42:56+00:00
8e0820fae460f0bf2b3e1cae44942390,2025-11-21T07:52:42Z,'Erdbeben Tote',orf.at,de,0.9,Mindestens drei Tote nach Erdbeben Bangladesch,,https://orf.at/stories/3412169/,https://orf.at/mojo/1_4_1/storyserver//news/common/images/og-fallback-news.png,,"Bei einem Erdbeben der Stärke 5,5 in Bangladesch sind nach Angaben der Regierung in Dhaka mindestens drei Menschen ums Leben gekommen. Das Erdbeben ereignete sich heute um 10.38 Uhr (Ortszeit, 05.38 … [+640 chars]",,Mindestens drei Tote nach Erdbeben Bangladesch. None,At least three dead after earthquake in Bangladesh. None,Saltem tres mortui sunt post terrae motus in Bangladesia. Nullus,2025-11-29 14:44:31+00:00
d622f3014a58df72bf99bee616e328b6,2025-11-21T08:39:16Z,'Erdbeben Epizentrum',www.zeit.de,de,0.9,Bangladesch: Mindestens drei Tote nach Erdbeben in Bangladesch,"Ein Erdbeben der Stärke 5,5 hat Bangladesch erschüttert. Mindestens drei Menschen wurden dabei getötet. Das Beben war Hunderte Kilometer vom Epizentrum entfernt spürbar.",https://www.zeit.de/gesellschaft/zeitgeschehen/2025-11/bangladesch-erdbeben-drei-tote-dhaka-gxe,https://img.zeit.de/2025-11/bangladesch-erdbeben-drei-tote-dhaka-bild/wide__1300x731,,Bei einem Erdbeben in Bangladesch sind nach Angaben der Regierung in Dhaka mindestens drei Menschen getötet worden. Weitere Menschen wurden verletzt und mehrere Gebäude in der Hauptstadt Dhaka beschä… [+1136 chars],,"Bangladesch: Mindestens drei Tote nach Erdbeben in Bangladesch. Ein Erdbeben der Stärke 5,5 hat Bangladesch erschüttert. Mindestens drei Menschen wurden dabei getötet. Das Beben war Hunderte Kilometer vom Epizentrum entfernt spürbar.",Bangladesh: At least three dead after earthquake in Bangladesh. A magnitude 5.5 earthquake struck Bangladesh. At least three people were killed. The quake was felt hundreds of kilometers from the epicenter.,Bangladesh: saltem tres mortui post terrae motus in Bangladesia. Magnitudo 5.5 terrae motus Bangladesh percussit. Saltem tres homines interfecti sunt. Motus centenis chiliometrorum ab epicente sentiebatur.,2025-11-29 14:44:31+00:00
b03b799236fff2f6997f1da93a70b059,2025-11-21T10:54:05Z,'Erdbeben Tote',www.zeit.de,de,0.9,Erdbeben: Mindestens vier Tote bei Erdbeben in Bangladesch,Hier finden Sie Informationen zu dem Thema „Erdbeben“. Lesen Sie jetzt „Mindestens vier Tote bei Erdbeben in Bangladesch“.,https://www.zeit.de/news/2025-11/21/mindestens-vier-tote-bei-erdbeben-in-bangladesch,https://img.zeit.de/news/2025-11/21/mindestens-vier-tote-bei-erdbeben-in-bangladesch-image-group/wide__1300x731,,"Bei einem Erdbeben im Zentralteil Bangladeschs sind mindestens vier Menschen ums Leben gekommen. Dutzende Menschen wurden verletzt, wie die Behörden des Landes mitteilten. In der Hauptstadt Dhaka und… [+780 chars]",,Erdbeben: Mindestens vier Tote bei Erdbeben in Bangladesch. Hier finden Sie Informationen zu dem Thema „Erdbeben“. Lesen Sie jetzt „Mindestens vier Tote bei Erdbeben in Bangladesch“.,Earthquake: At least four dead in earthquake in Bangladesh. Here you will find information on the topic of “earthquakes”. Now read “At least four dead in Bangladesh earthquake”.,"Terrae motus: Saltem quattuor mortui in terrae motu in Bangladesia. Hic informationes invenies in argumento ""terrae motuum"". Nunc legitur ""Quatuor saltem mortui in terrae motu Bangladesh"".",2025-11-29 14:44:31+00:00
b1322773bca892bfb0432de18efd3d69,2025-11-21T10:55:18Z,'Erdbeben',www.tagesspiegel.de,de,0.9,Erdbeben: Mindestens vier Tote bei Erdbeben in Bangladesch,"Ein Erdbeben hat Zentral-Bangladesch erschüttert. Mindestens vier Menschen starben, darunter ein Baby. Viele Gebäude wankten, Bewohner liefen in Panik auf die Straße.",https://www.tagesspiegel.de/gesellschaft/panorama/erdbeben-mindestens-vier-tote-bei-erdbeben-in-bangladesch-14907845.html,https://www.tagesspiegel.de/images/14907842/alternates/BASE_16_9_W1400/1763722518000/erdbeben-in-bangladesch.jpeg,,"Bei einem Erdbeben im Zentralteil Bangladeschs sind mindestens vier Menschen ums Leben gekommen. Dutzende Menschen wurden verletzt, wie die Behörden des Landes mitteilten. In der Hauptstadt Dhaka und… [+834 chars]",,"Erdbeben: Mindestens vier Tote bei Erdbeben in Bangladesch. Ein Erdbeben hat Zentral-Bangladesch erschüttert. Mindestens vier Menschen starben, darunter ein Baby. Viele Gebäude wankten, Bewohner liefen in Panik auf die Straße.","Earthquake: At least four dead in earthquake in Bangladesh. An earthquake has shaken central Bangladesh. At least four people died, including a baby. Many buildings shook and residents ran into the streets in panic.","Terrae motus: Saltem quattuor mortui in terrae motu in Bangladesia. Terrae motus media Bangladesia concussit. Saltem quattuor homines mortui sunt, infans inclusus. Multa aedificia commota sunt et incolas in plateas perterritos cucurrerunt.",2025-11-29 14:44:31+00:00
13c583ba37fe94f404a6681cd2ae892c,2025-11-21T11:41:46Z,'Erdbeben Verletzte',www.stern.de,de,0.9,Mindestens fünf Tote und dutzende Verletzte bei Erdbeben in Bangladesch,"In Bangladesch hat ein Erdbeben der Stärke 5,5 am Freitag die Umgebung der dicht besiedelten Hauptstadt Dhaka erschüttert. Wie die Regierung mitteilte, gab es mindestens fünf Tote und etwa hundert Verletzte. Nach Angaben der US-Erdbebenwarte USGS befand sich …",https://www.stern.de/news/mindestens-fuenf-tote-und-dutzende-verletzte-bei-erdbeben-in-bangladesch-36829796.html,https://image.stern.de/36829798/t/q0/v1/w1440/r1.7778/-/21--beschaedigtes-gebaeude-in-dhaka---0bf35745b80bfbf1.jpg,,"Kopiere den aktuellen Link
Zur Merkliste hinzufügen
In Bangladesch hat ein Erdbeben der Stärke 5,5 am Freitag die Umgebung der dicht besiedelten Hauptstadt Dhaka erschüttert. Wie die Regierung mitt… [+1705 chars]",,"Mindestens fünf Tote und dutzende Verletzte bei Erdbeben in Bangladesch. In Bangladesch hat ein Erdbeben der Stärke 5,5 am Freitag die Umgebung der dicht besiedelten Hauptstadt Dhaka erschüttert. Wie die Regierung mitteilte, gab es mindestens fünf Tote und etwa hundert Verletzte. Nach Angaben der US-Erdbebenwarte USGS befand sich …","At least five dead and dozens injured in earthquake in Bangladesh. In Bangladesh, a magnitude 5.5 earthquake struck the surrounding areas of the densely populated capital Dhaka on Friday. According to the government, there were at least five dead and around a hundred injured. According to the US Earthquake Observatory USGS,...","Saltem quinque mortui et justo laesi terrae motu in Bangladesia sunt. In Bangladesia, magnitudo 5.5 terrae motus circum areas densissimarum capitis Dhaka die Veneris percussit. Secundum imperium, saltem quinque mortui et circiter centum vulnerati erant. Secundum US Terraemotus Observatorii USGS, ...",2025-11-29 14:44:31+00:00
5698e9229fb317bb14383902059a2a4f,2025-11-22T01:45:41Z,'Erdbeben',www.tagesschau.de,de,0.9,Mindestens neun Tote bei Erdbeben in Bangladesch,"Dhaka ist eine der am dichtesten besiedelten Städte der Welt. Nur wenige Kilometer entfernt davon lag das Epizentrum des Erdbebens, das Bangladesch erschüttert hat. Mindestens neun Menschen starben, Hunderte wurden verletzt.",https://www.tagesschau.de/ausland/asien/erdbeben-bangladesch-102.html,https://images.tagesschau.de/image/08059f9e-b764-4dbc-a35e-62bdb23743e7/AAABmqk9CMk/AAABmgWmh8Q/16x9-big/erdbeben-bangaldesch-100.jpg?width=1280,,"Stand: 22.11.2025 02:45 Uhr
Dhaka ist eine der am dichtesten besiedelten Städte der Welt. Nur wenige Kilometer entfernt davon lag das Epizentrum des Erdbebens, das Bangladesch erschüttert hat. Minde… [+1197 chars]",,"Mindestens neun Tote bei Erdbeben in Bangladesch. Dhaka ist eine der am dichtesten besiedelten Städte der Welt. Nur wenige Kilometer entfernt davon lag das Epizentrum des Erdbebens, das Bangladesch erschüttert hat. Mindestens neun Menschen starben, Hunderte wurden verletzt.",At least nine dead in earthquake in Bangladesh. Dhaka is one of the most densely populated cities in the world. Just a few kilometers away was the epicenter of the earthquake that shook Bangladesh. At least nine people died and hundreds were injured.,Terraemotus in Bangladesia mortuus est saltern novem. Dhaka est una ex frequentissimis urbibus orbis terrarum. Paucis chiliometris aberat epicenter terrae motus qui Bangladesh concussit. Saltem novem homines mortui sunt et centeni vulnerati sunt.,2025-11-29 14:44:31+00:00
