index,published,keyword,domain,language,valid,title,description,url,image,archive,content,quote,de,en,la,added
8595e848433f6d4fed663163a3d958c7,2025-10-10T09:55:08Z,'Erdbeben',www.faz.net,de,0.6,Philippinen: Tsunami-Warnung nach Erdbeben wieder aufgehoben,Wieder erschüttert ein schweres Erdbeben die Philippinen. Ein befürchteter Tsunami bleibt aus – das Ausmaß der Schäden ist allerdings noch unklar. Das Land ist schlecht auf Katastrophen vorbereitet.,https://www.faz.net/aktuell/gesellschaft/ungluecke/staerke-7-4-wieder-starkes-beben-auf-den-philippinen-accg-110725490.html,https://media0.faz.net/ppmedia/w1200/aktuell/gesellschaft/717819579/1.10725492/facebook_teaser/krankenwagen-sind-in.jpg.webp,,"Nur etwas mehr als eine Woche nach einem starken Erdbeben im Zentrum der Philippinen wurde das Land abermals von heftigen Erdstößen erschüttert. Das Erdbeben, das der US-Erdbebenwarte (USGS) zufolge … [+2635 chars]",,Philippinen: Tsunami-Warnung nach Erdbeben wieder aufgehoben. Wieder erschüttert ein schweres Erdbeben die Philippinen. Ein befürchteter Tsunami bleibt aus – das Ausmaß der Schäden ist allerdings noch unklar. Das Land ist schlecht auf Katastrophen vorbereitet.,Philippines: Tsunami warning lifted after earthquake. Another severe earthquake shakes the Philippines. A feared tsunami has not materialized - but the extent of the damage is still unclear. The country is ill-prepared for disasters.,Philippinae: Tsunami admonitio post terrae motus sustulit. Alius terrae motus graves Philippinas quatit. Timui tsunami non materiata est - sed amplitudo damni adhuc incertus est. Patria calamitatibus male paratur.,2025-10-22 05:46:29+00:00
a152ff3bb24431c1eb95cfc4d57e6f34,2025-10-15T11:37:22Z,'Erdbeben Schäden',www.morgenpost.de,de,0.6,Droht Mega-Beben in Kalifornien? Experten fürchten Kettenreaktion,Ein Mega-Beben im Norden Kaliforniens könnte auch die San-Andreas-Verwerfung aufbrechen lassen. Und das schon in naher Zukunft.,https://www.morgenpost.de/panorama/article410219990/droht-mega-beben-in-kalifornien-experten-fuerchten-kettenreaktion.html,https://img.sparknews.funkemedien.de/407582358/407582358_1730335826_v16_9_1600.jpeg,,"Seit Jahren warnen Forscher in den USA vor einem Horrorszenario: einem gigantischen Erdbeben entlang der San-Andreas-Verwerfung, das in Kalifornien Millionenstädte wie San Francisco oder Los Angeles … [+4908 chars]",,Droht Mega-Beben in Kalifornien? Experten fürchten Kettenreaktion. Ein Mega-Beben im Norden Kaliforniens könnte auch die San-Andreas-Verwerfung aufbrechen lassen. Und das schon in naher Zukunft.,Is there a risk of a mega-earthquake in California? Experts fear a chain reaction. A megaquake in northern California could also cause the San Andreas Fault to rupture. And that in the near future.,Estne periculum mega-terrae in California? catenam periti reactionem timent. Megaquake in California septentrionali etiam San Andreas Fault rumpere potuit. Et hoc in proximo.,2025-10-22 05:46:29+00:00
c7cc315f987a2a4a4229e2f56272f5e6,2025-10-20T13:24:19Z,'Erdbeben',noe.orf.at,de,0.6,Erneut Erdbeben im Bezirk Neunkirchen,"Im Bezirk Neunkirchen hat die Erde am Montag erneut gebebt. Um 13.54 Uhr wurden westlich von Neunkirchen Erschütterungen der Magnitude 3,2 registriert, berichtete GeoSphere Austria (Österreichischer Erdbebendienst).",https://noe.orf.at/stories/3326606/,https://ibs.orf.at/noe?image=https%3A%2F%2Foekastatic.orf.at%2Fmims%2F2024%2F01%2F80%2Fcrops%2Fw%3D1200%2Ch%3D627%2Cq%3D75%2F2470201_master_945280_adobestock_196122496.jpeg%3Fs%3Dc090d9738db56835610b16f9e33985f814e23058,,"Das Beben wurde von vielen deutlich verspürt, Gegenstände bewegten sich und ein Grollen des Untergrundes wurde wahrgenommen, hieß es. Schäden an Gebäuden seien bei dieser Stärke nicht zu erwarten.
E… [+517 chars]",,"Erneut Erdbeben im Bezirk Neunkirchen. Im Bezirk Neunkirchen hat die Erde am Montag erneut gebebt. Um 13.54 Uhr wurden westlich von Neunkirchen Erschütterungen der Magnitude 3,2 registriert, berichtete GeoSphere Austria (Österreichischer Erdbebendienst).","Another earthquake in the Neunkirchen district. The earth shook again on Monday in the Neunkirchen district. At 1:54 p.m. tremors of magnitude 3.2 were recorded west of Neunkirchen, GeoSphere Austria (Austrian Seismological Service) reported.","Alius terrae motus in regione Neunkirchen. Terra die Lunae in Neunkirchen iterum commota est. Ad a.m. tremores magnitudinis 3.2 scripti occidentales Neunkirchen, GeoSphere Austriae (Austrian Seismological Service) retulerunt.",2025-10-22 05:46:29+00:00
cbb8c2949e4c9d4676373f8d42ea0da7,2025-10-28T09:20:58Z,'Erdbeben',www.stern.de,de,0.6,Erdbebendienst: Zwei Mikro-Erdbeben im Kreis Neu-Ulm registriert,"Neu-Ulm - Im Kreis Neu-Ulm sind in der Nacht zum Montag zwei sehr schwache Erdbeben gemessen worden. Die Erdstöße mit einer Stärke von 1,5 und 1,6",https://www.stern.de/gesellschaft/regional/baden-wuerttemberg/erdbebendienst--zwei-mikro-erdbeben-im-kreis-neu-ulm-registriert-36167770.html,https://image.stern.de/36167772/t/g4/v1/w1440/r1.7778/-/28--oyjt4aia5gv7axs2048jpeg---dead07b75453ea0e.jpg,,"Kopiere den aktuellen Link
Zur Merkliste hinzufügen
Zwei Erdstöße wurden im Kreis Neu-Ulm registriert spürbar waren sie laut Erdbebendienst aber nicht.
Im Kreis Neu-Ulm sind in der Nacht zum Monta… [+661 chars]",,"Erdbebendienst: Zwei Mikro-Erdbeben im Kreis Neu-Ulm registriert. Neu-Ulm - Im Kreis Neu-Ulm sind in der Nacht zum Montag zwei sehr schwache Erdbeben gemessen worden. Die Erdstöße mit einer Stärke von 1,5 und 1,6",Earthquake service: Two micro-earthquakes registered in the Neu-Ulm district. Neu-Ulm - Two very weak earthquakes were measured in the Neu-Ulm district on Monday night. The tremors with a magnitude of 1.5 and 1.6,Terrae motus servitus: duae parvae terrae motus in regione Neu-Ulm descripserunt. Neu-Ulm - Duo terrae motus valde debiles die Lunae nocte in regione Neu-Ulm metiebantur. De tremoribus cum magnitudine 1.5 et 1.6,2025-10-22 05:46:29+00:00
4280ab29df4622eb5b8e2e8ff085371e,2025-10-28T09:20:58Z,'Erdbeben Schäden',www.zeit.de,de,0.6,Erdbebendienst: Zwei Mikro-Erdbeben im Kreis Neu-Ulm registriert,Hier finden Sie Informationen zu dem Thema „Erdbebendienst“. Lesen Sie jetzt „Zwei Mikro-Erdbeben im Kreis Neu-Ulm registriert“.,https://www.zeit.de/news/2025-10/28/zwei-mikro-erdbeben-im-kreis-neu-ulm-registriert,https://img.zeit.de/news/2025-10/28/zwei-mikro-erdbeben-im-kreis-neu-ulm-registriert-image-group/wide__1300x731,,"Im Kreis Neu-Ulm sind in der Nacht zum Montag zwei sehr schwache Erdbeben gemessen worden. Die Erdstöße mit einer Stärke von 1,5 und 1,6 traten nach Angaben von Seismologen um 2.46 Uhr und 3.20 Uhr a… [+546 chars]",,Erdbebendienst: Zwei Mikro-Erdbeben im Kreis Neu-Ulm registriert. Hier finden Sie Informationen zu dem Thema „Erdbebendienst“. Lesen Sie jetzt „Zwei Mikro-Erdbeben im Kreis Neu-Ulm registriert“.,Earthquake service: Two micro-earthquakes registered in the Neu-Ulm district. Here you will find information on the topic of “earthquake service”. Now read “Two micro-earthquakes registered in the Neu-Ulm district”.,"Terrae motus servitus: duae parvae terrae motus in regione Neu-Ulm descripserunt. Hic informationes invenies in argumento ""servitii terrae"". Nunc lege ""Duae parvae terrae motus in regione Neu-Ulm descripserunt"".",2025-10-22 05:46:29+00:00
5ef1826cc83929d8f8b8d54c7b1c126b,2025-10-07T13:06:08Z,'Erdbeben Erdplatte',www.spektrum.de,de,0.7,Erdbeben: Ein seltsamer Prozess vor Portugal könnte das Ende des Atlantiks einläuten – und eine rätselhafte historische Katastrophe erklären.,"Vor Portugal kann man womöglich einen der rätselhaftesten Prozesse der Erde in Echtzeit beobachten. Eventuell erklärt er auch, warum das Erdbeben von Lissabon 1755 so schwer war.",https://www.spektrum.de/news/erdbeben-ende-des-atlantiks-koennte-historische-katastrophe-erklaeren/2290215,https://static.spektrum.de/fm/912/f1920x1080/GettyImages-647611062.jpg,,"Der Atlantik ist dem Untergang geweiht. Derzeit wird er zwar immer noch breiter, doch Fachleute rechnen damit, dass er bald schon wieder schrumpft. Wie dieser Prozess allerdings beginnt, ist bis heut… [+3515 chars]",,"Erdbeben: Ein seltsamer Prozess vor Portugal könnte das Ende des Atlantiks einläuten – und eine rätselhafte historische Katastrophe erklären.. Vor Portugal kann man womöglich einen der rätselhaftesten Prozesse der Erde in Echtzeit beobachten. Eventuell erklärt er auch, warum das Erdbeben von Lissabon 1755 so schwer war.",Earthquake: A strange process off Portugal could herald the end of the Atlantic - and explain a mysterious historical catastrophe. One of the most mysterious processes on earth may be observed in real time off Portugal. It may also explain why the 1755 Lisbon earthquake was so severe.,Motus: Mirus processus Portugalliae off finem Atlantici praenuntiare potuit - et calamitatem historicam arcanam explanare. Unus ex occultis processibus in terra in tempore reali Portugalliae observari potest. Etiam explicari potest cur terrae motus Lisbon 1755 tam gravis sit.,2025-10-22 05:46:29+00:00
2be757d4d5e288e33608f7e665f575e6,2025-10-10T02:41:34Z,'Erdbeben',www.zeit.de,de,0.7,"Stärke 7,4: Starkes Erdbeben auf Philippinen löst Tsunami-Warnung aus","Hier finden Sie Informationen zu dem Thema „Stärke 7,4“. Lesen Sie jetzt „Starkes Erdbeben auf Philippinen löst Tsunami-Warnung aus“.",https://www.zeit.de/news/2025-10/10/starkes-erdbeben-auf-philippinen-loest-tsunami-warnung-aus,https://img.zeit.de/news/2025-10/10/starkes-erdbeben-auf-philippinen-loest-tsunami-warnung-aus-image-group/wide__1300x731,,Nur wenige Tage nach dem letzten starken Erdbeben auf den Philippinen hat ein weiteres heftiges Beben den Inselstaat erschüttert. Laut der US-Erdbebenwarte USGS hatte das Beben am Morgen (Ortszeit) d… [+1710 chars],,"Stärke 7,4: Starkes Erdbeben auf Philippinen löst Tsunami-Warnung aus. Hier finden Sie Informationen zu dem Thema „Stärke 7,4“. Lesen Sie jetzt „Starkes Erdbeben auf Philippinen löst Tsunami-Warnung aus“.",Magnitude 7.4: Strong earthquake in Philippines triggers tsunami warning. Here you will find information on the topic “Strength 7.4”. Now read “Strong earthquake in Philippines triggers tsunami warning”.,"Magnitudo 7.4: Terrae motus validus in Philippinis triggers tsunami admonitionem. Hic informationes invenies in argumento “Vir 7.4”. Nunc legitur ""Terrae motus validus in Philippinis triggers tsunami admonitionem"".",2025-10-22 05:46:29+00:00
e83cef64dff499935e07f80b444f443e,2025-10-10T02:41:34Z,'schweres Erdbeben',www.stern.de,de,0.7,"Stärke 7,4: Starkes Erdbeben auf Philippinen löst Tsunami-Warnung aus",Wieder erschüttert ein schweres Erdbeben die Philippinen. Die Behörden warnen vor einer zerstörerischen Flutwelle: Anwohner in Küstenregionen sollen sich in Sicherheit bringen.,https://www.stern.de/panorama/philippinen--starkes-erdbeben-loest-tsunami-warnung-aus-36119670.html,https://image.stern.de/36119672/t/LP/v2/w1440/r1.7778/-/erdbeben-philippinen.jpg,,"Kopiere den aktuellen Link
Zur Merkliste hinzufügen
Wieder erschüttert ein schweres Erdbeben die Philippinen. Die Behörden warnen vor einer zerstörerischen Flutwelle: Anwohner in Küstenregionen sol… [+1082 chars]",,"Stärke 7,4: Starkes Erdbeben auf Philippinen löst Tsunami-Warnung aus. Wieder erschüttert ein schweres Erdbeben die Philippinen. Die Behörden warnen vor einer zerstörerischen Flutwelle: Anwohner in Küstenregionen sollen sich in Sicherheit bringen.",Magnitude 7.4: Strong earthquake in Philippines triggers tsunami warning. Another severe earthquake shakes the Philippines. The authorities are warning of a destructive tidal wave: residents in coastal regions should seek safety.,Magnitudo 7.4: Terrae motus validus in Philippinis triggers tsunami admonitionem. Alius terrae motus graves Philippinas quatit. Auctores monent undam perniciosam: incolas regionum maritimarum salutem quaerere debent.,2025-10-22 05:46:29+00:00
c3eb65b31daa1c82cd0c5b20df4f8172,2025-10-10T02:43:17Z,'starkes Erdbeben',www.tagesspiegel.de,de,0.7,"Stärke 7,4: Starkes Erdbeben auf Philippinen löst Tsunami-Warnung aus",Wieder erschüttert ein schweres Erdbeben die Philippinen. Die Behörden warnen vor einer zerstörerischen Flutwelle: Anwohner in Küstenregionen sollen sich in Sicherheit bringen.,https://www.tagesspiegel.de/gesellschaft/panorama/starke-74-starkes-erdbeben-auf-philippinen-lost-tsunami-warnung-aus-14526356.html,https://www.tagesspiegel.de/images/14526353/alternates/BASE_16_9_W1400/1760064197000/erdbeben-auf-den-philippinen.jpeg,,"Nur wenige Tage nach dem letzten starken Erdbeben auf den Philippinen hat ein weiteres heftiges Beben den Inselstaat erschüttert. Laut der US-Erdbebenwarte USGS hatte das Beben die Stärke 7,4. Das Ze… [+1589 chars]",,"Stärke 7,4: Starkes Erdbeben auf Philippinen löst Tsunami-Warnung aus. Wieder erschüttert ein schweres Erdbeben die Philippinen. Die Behörden warnen vor einer zerstörerischen Flutwelle: Anwohner in Küstenregionen sollen sich in Sicherheit bringen.",Magnitude 7.4: Strong earthquake in Philippines triggers tsunami warning. Another severe earthquake shakes the Philippines. The authorities are warning of a destructive tidal wave: residents in coastal regions should seek safety.,Magnitudo 7.4: Terrae motus validus in Philippinis triggers tsunami admonitionem. Alius terrae motus graves Philippinas quatit. Auctores monent undam perniciosam: incolas regionum maritimarum salutem quaerere debent.,2025-10-22 05:46:29+00:00
ea4089f6ce33be68b7427de39c4abb65,2025-10-10T02:53:49Z,'starkes Erdbeben',www.morgenpost.de,de,0.7,Tsunami-Warnung: Wieder starkes Erdbeben auf den Philippinen,Wieder erschüttert ein schweres Erdbeben die Philippinen. Behörden warnen vor zerstörerischer Flutwelle: Anwohner an der Küste sind in Gefahr.,https://www.morgenpost.de/panorama/article410193048/tsunami-warnung-wieder-starkes-erdbeben-auf-den-philippinen.html,https://img.sparknews.funkemedien.de/410193047/410193047_1760064829_v16_9_1600.jpeg,,"Nur wenige Tage nach dem letzten starken Erdbeben auf den Philippinen hat ein weiteres heftiges Beben den Inselstaat erschüttert. Laut der US-Erdbebenwarte USGS hatte das Beben die Stärke 7,4. Das Ze… [+831 chars]",,Tsunami-Warnung: Wieder starkes Erdbeben auf den Philippinen. Wieder erschüttert ein schweres Erdbeben die Philippinen. Behörden warnen vor zerstörerischer Flutwelle: Anwohner an der Küste sind in Gefahr.,Tsunami warning: Another strong earthquake in the Philippines. Another severe earthquake shakes the Philippines. Authorities warn of destructive tidal wave: residents on the coast are in danger.,Tsunami admonitio: Alius fortis terrae motus in Philippinis. Alius terrae motus graves Philippinas quatit. Auctoritates monent undas perniciosae Thadal: habitant in ora maritima periclitantur.,2025-10-22 05:46:29+00:00
d1d9477ebf753a8d4a8bea8c242861a0,2025-10-10T03:21:26Z,'schweres Erdbeben',www.focus.de,de,0.7,Starkes Erdbeben auf Philippinen löst Tsunami-Warnung aus,Wieder erschüttert ein schweres Erdbeben die Philippinen. Die Behörden warnen vor einer zerstörerischen Flutwelle: Anwohner in Küstenregionen sollen sich in Sicherheit bringen.,https://www.focus.de/panorama/welt/starkes-erdbeben-auf-philippinen-loest-tsunami-warnung-aus_3b7a4c33-7c20-4f1f-a04b-4473e4949c6a.html,https://quadro.burda-forward.de/ctf/c8668ebc-5d0f-4332-bf20-50e7086fb068.40b6d0b7-8bbc-4672-b966-e4d3d437261c.jpeg?im=RegionOfInterestCrop%3D%281200%2C630%29%2CregionOfInterest%3D%28896%2C820%29&hash=872dd9c860f280880473a0aa919f473355378efe9ee843b89466530552f1ac63,,Nur wenige Tage nach dem letzten starken Erdbeben auf den Philippinen hat ein weiteres heftiges Beben den Inselstaat erschüttert. Laut der US-Erdbebenwarte USGS hatte das Beben am Morgen (Ortszeit) d… [+1578 chars],,Starkes Erdbeben auf Philippinen löst Tsunami-Warnung aus. Wieder erschüttert ein schweres Erdbeben die Philippinen. Die Behörden warnen vor einer zerstörerischen Flutwelle: Anwohner in Küstenregionen sollen sich in Sicherheit bringen.,Strong earthquake in Philippines triggers tsunami warning. Another severe earthquake shakes the Philippines. The authorities are warning of a destructive tidal wave: residents in coastal regions should seek safety.,Terrae motus validus in Philippinis triggers tsunami observavit. Alius terrae motus graves Philippinas quatit. Auctores monent undam perniciosam: incolas regionum maritimarum salutem quaerere debent.,2025-10-22 05:46:29+00:00
1df49a5c8c381bbd6e846e9116f707a9,2025-10-10T03:24:50Z,'schweres Erdbeben',www.tagesschau.de,de,0.7,Starkes Erdbeben auf Philippinen löst Tsunami-Warnung aus,"Wieder hat ein schweres Erdbeben die Philippinen erschüttert. Das Epizentrum lag in geringer Tiefe auf der Insel Mindanao. Die Behörden warnen vor einer zerstörerischen Flutwelle, Anwohner in Küstenregionen sollen sich in Sicherheit bringen.",https://www.tagesschau.de/ausland/asien/erdbeben-philippinen-130.html,https://images.tagesschau.de/image/b9e9344e-5db8-47a0-a74c-caa1e74c1797/AAABmcwmXTs/AAABmKJZ-0g/16x9-big/davao-erdbeben-100.jpg?width=1280,,"Stand: 10.10.2025 05:24 Uhr
Wieder hat ein schweres Erdbeben die Philippinen erschüttert. Das Epizentrum lag in geringer Tiefe auf der Insel Mindanao. Die Behörden warnen vor einer zerstörerischen F… [+1838 chars]",,"Starkes Erdbeben auf Philippinen löst Tsunami-Warnung aus. Wieder hat ein schweres Erdbeben die Philippinen erschüttert. Das Epizentrum lag in geringer Tiefe auf der Insel Mindanao. Die Behörden warnen vor einer zerstörerischen Flutwelle, Anwohner in Küstenregionen sollen sich in Sicherheit bringen.",Strong earthquake in Philippines triggers tsunami warning. Another severe earthquake has hit the Philippines. The epicenter was at a shallow depth on the island of Mindanao. The authorities are warning of a destructive tidal wave and residents in coastal regions should seek safety.,Terrae motus validus in Philippinis triggers tsunami observavit. Alius terrae motus graves Philippinas feriat. Epicenter erat in insula Mindanao ad altitudinem exiguam. Auctores monent de fluctus aestuum perniciosos et incolas in regionibus maritimis salutem quaerere debere.,2025-10-22 05:46:29+00:00
e67408bb3f3b9ea4d4fce24d442481cb,2025-10-10T03:35:00Z,'starkes Erdbeben',www.faz.net,de,0.7,Behörden warnen: Starkes Erdbeben auf Philippinen löst Tsunami-Warnung aus,Wieder erschüttert ein schweres Erdbeben die Philippinen. Die Behörden warnen vor einer zerstörerischen Flutwelle: Anwohner in Küstenregionen sollen sich in Sicherheit bringen.,https://www.faz.net/aktuell/gesellschaft/ungluecke/behoerden-warnen-starkes-erdbeben-auf-philippinen-loest-tsunami-warnung-aus-accg-110725490.html,https://media0.faz.net/ppmedia/w1200/aktuell/gesellschaft/717819579/1.10725492/facebook_teaser/krankenwagen-sind-in.jpg.webp,,"Nur wenige Tage nach dem letzten starken Erdbeben auf den Philippinen hat ein weiteres heftiges Beben den Inselstaat erschüttert. Laut der US-Erdbebenwarte USGS hatte das Beben die Stärke 7,4. Das Ze… [+826 chars]",,Behörden warnen: Starkes Erdbeben auf Philippinen löst Tsunami-Warnung aus. Wieder erschüttert ein schweres Erdbeben die Philippinen. Die Behörden warnen vor einer zerstörerischen Flutwelle: Anwohner in Küstenregionen sollen sich in Sicherheit bringen.,Authorities warn: Strong earthquake in Philippines triggers tsunami warning. Another severe earthquake shakes the Philippines. The authorities are warning of a destructive tidal wave: residents in coastal regions should seek safety.,Auctoritates monent: Terrae motus in Philippinis triggers tsunami admonitio. Alius terrae motus graves Philippinas quatit. Auctores monent undam perniciosam: incolas regionum maritimarum salutem quaerere debent.,2025-10-22 05:46:29+00:00
6d57f1b928c60417c76d095896047a53,2025-10-10T04:24:54Z,'Erdbeben',www.diepresse.com,de,0.7,"Tsunamiwarnung nach Erdbeben der Stärke 7,6 auf den Philippinen","Flutwellen von mehr als einem Meter Höhe könnten auf Land treffen. Die Menschen werden aufgefordert, sich in höher gelegene Gebiete zu begeben.",https://www.diepresse.com/20188322/tsunamiwarnung-nach-erdbeben-der-staerke-7-6-auf-den-philippinen,https://img.diepresse.com/public/incoming/1g8mrr-PHILIPPINES-EARTHQUAKE-TSUNAMI/alternates/DPR_SOCIAL_NACHRICHTEN/PHILIPPINES-EARTHQUAKE-TSUNAMI,,"Flutwellen von mehr als einem Meter Höhe könnten auf Land treffen. Die Menschen werden aufgefordert, sich in höher gelegene Gebiete zu begeben.
Wenige Tage nach dem letzten starken Erdstoß hat ein w… [+1617 chars]",,"Tsunamiwarnung nach Erdbeben der Stärke 7,6 auf den Philippinen. Flutwellen von mehr als einem Meter Höhe könnten auf Land treffen. Die Menschen werden aufgefordert, sich in höher gelegene Gebiete zu begeben.",Tsunami warning after 7.6 magnitude earthquake in the Philippines. Tidal waves more than a meter high could hit land. People are urged to move to higher ground.,Monitio tsunami post 7.6 magnitudinis terrae motus in Philippinis. Tidal undas plus quam metrum altum terram ferire potuit. Homines ad altiora loca movenda incitantur.,2025-10-22 05:46:29+00:00
a4ace06b9125bfccbe66116380621ba0,2025-10-10T05:54:37Z,'Erdbeben',www.n-tv.de,de,0.7,Behörden warnen vor Tsunami: Weiteres Erdbeben erschüttert die Philippinen,"Anfang Oktober sterben bei einem Erdbeben auf den Philippinen mehr als 70 Menschen. Nun trifft das Land ein weiteres Beben. Sicherheitskräfte warnen in mehreren Provinzen vor Flutwellen, Anwohner sollen sich in Sicherheit bringen.",https://www.n-tv.de/panorama/Weiteres-Erdbeben-erschuettert-die-Philippinen-article26087168.html,https://www.n-tv.de/img/incoming/crop26087180/443132650-cImg_16_9-w1200/551836511.jpg,,"Anfang Oktober sterben bei einem Erdbeben auf den Philippinen mehr als 70 Menschen. Nun trifft das Land ein weiteres Beben. Sicherheitskräfte warnen in mehreren Provinzen vor Flutwellen, Anwohner sol… [+2561 chars]",,"Behörden warnen vor Tsunami: Weiteres Erdbeben erschüttert die Philippinen. Anfang Oktober sterben bei einem Erdbeben auf den Philippinen mehr als 70 Menschen. Nun trifft das Land ein weiteres Beben. Sicherheitskräfte warnen in mehreren Provinzen vor Flutwellen, Anwohner sollen sich in Sicherheit bringen.","Authorities warn of tsunami: another earthquake shakes the Philippines. At the beginning of October, more than 70 people died in an earthquake in the Philippines. Now another earthquake is hitting the country. Security forces are warning of tidal waves in several provinces and residents should seek safety.",Auctoritates de tsunami monent: alius terrae motus Philippinas concutit. Ineunte Octobri plus quam 70 homines terrae motu in Philippinis mortui sunt. Nunc alius terrae motus ferendi est. Copiae securitatis monent aestuum fluctuum in pluribus provinciis et incolas salutem petere debere.,2025-10-22 05:46:29+00:00
6f801a0e0805ffa1a68352d3cc2418d7,2025-10-26T07:55:37Z,'Erdbeben',orf.at,de,0.7,Erdbeben in Süditalien weithin spürbar,,https://orf.at/stories/3409588/,https://orf.at/mojo/1_4_1/storyserver//news/common/images/og-fallback-news.png,,"Ein Beben der Stärke 4,0 hat in der Nacht auf heute die Gegend um die süditalienische Stadt Avellino erschüttert. Laut dem italienischen Institut für Geophysik und Vulkanologie (INGV) lag das Epizent… [+1394 chars]",,Erdbeben in Süditalien weithin spürbar. nan,Earthquake widely felt in southern Italy. nan,Terrae motus late in Italia australi sentitur. nan,2025-10-22 05:46:29+00:00
4b3a8061cbf155ea3dcb0fd906d7526c,2025-10-29T13:27:05Z,'Erdbeben Schäden',www.zeit.de,de,0.7,Katastrophen: Großes Wohnhaus in der Türkei eingestürzt – Zwei Kinder tot,Hier finden Sie Informationen zu dem Thema „Katastrophen“. Lesen Sie jetzt „Großes Wohnhaus in der Türkei eingestürzt – Zwei Kinder tot“.,https://www.zeit.de/news/2025-10/29/grosses-wohnhaus-in-tuerkei-eingestuerzt-familie-verschuettet,https://img.zeit.de/news/2025-10/29/grosses-wohnhaus-in-tuerkei-eingestuerzt-familie-verschuettet-image-group/wide__1300x731,,"Ein Wohngebäude ist im Nordwesten der Türkei eingestürzt und hat eine fünfköpfige Familie unter sich begraben, darunter drei Kinder. Rettungskräfte bargen am Mittag zwei Leichen, bei denen es sich um… [+1340 chars]",,Katastrophen: Großes Wohnhaus in der Türkei eingestürzt – Zwei Kinder tot. Hier finden Sie Informationen zu dem Thema „Katastrophen“. Lesen Sie jetzt „Großes Wohnhaus in der Türkei eingestürzt – Zwei Kinder tot“.,Disasters: Large residential building collapsed in Turkey – two children dead. Here you can find information on the topic of “disasters”. Now read “Large residential building collapsed in Turkey – two children dead”.,"Clades: Magnae aedificii residentiales in Turcia corruerunt – duo filii mortui sunt. Hic invenire potes de argumento ""clades"". Nunc legitur ""Magnum aedificium residentiale in Turcia concidit - duos filios mortuos"".",2025-10-22 05:46:29+00:00
