index,published,keyword,domain,language,valid,title,description,url,image,archive,content,quote,de,en,la,added
41d21ec295d825242ea370d258eac95b,2025-10-30T07:51:49Z,'Erdbeben Schäden',www.stern.de,de,0.7,Katastrophen: Haus in Türkei eingestürzt – Eltern und Kinder tot,In der Nähe von Istanbul stürzt ein Wohnhaus ein. Schnell ist klar: Unter den Trümmern liegt eine fünfköpfige Familie begraben. Trotz stundenlangem Einsatz kann nur ein Leben gerettet werden.,https://www.stern.de/panorama/katastrophen--haus-in-tuerkei-eingestuerzt---eltern-und-kinder-tot-36174668.html,https://image.stern.de/36174670/t/a_/v1/w1440/r1.7778/-/30--aoeoljx73av1axs2048jpeg---d471e256f8515883.jpg,,"Kopiere den aktuellen Link
Zur Merkliste hinzufügen

In der Nähe von Istanbul stürzt ein Wohnhaus ein. Schnell ist klar: Unter den Trümmern liegt eine fünfköpfige Familie begraben. Trotz stundenlang… [+1886 chars]",,Katastrophen: Haus in Türkei eingestürzt – Eltern und Kinder tot. In der Nähe von Istanbul stürzt ein Wohnhaus ein. Schnell ist klar: Unter den Trümmern liegt eine fünfköpfige Familie begraben. Trotz stundenlangem Einsatz kann nur ein Leben gerettet werden.,"Disasters: House collapsed in Türkiye – parents and children dead. A residential building collapses near Istanbul. It quickly becomes clear: a family of five is buried under the rubble. Despite hours of effort, only one life can be saved.","Clades: Domus in Türkiye concidit – parentes et liberi mortui sunt. Aedificium residentiale prope Istanbul concidit. Cito patet: familia quinque sub ruderibus sepelitur. Quamvis horae laboris, una tantum vita salvari potest.",2025-10-22 05:46:29+00:00
09604eff305607d7b297860963318e20,2025-10-30T07:53:05Z,'Erdbeben Schäden',www.tagesspiegel.de,de,0.7,Katastrophen: Haus in Türkei eingestürzt – Eltern und Kinder tot,In der Nähe von Istanbul stürzt ein Wohnhaus ein. Schnell ist klar: Unter den Trümmern liegt eine fünfköpfige Familie begraben. Trotz stundenlangem Einsatz kann nur ein Leben gerettet werden.,https://www.tagesspiegel.de/gesellschaft/panorama/katastrophen-haus-in-turkei-eingesturzt--eltern-und-kinder-tot-14700422.html,https://www.tagesspiegel.de/images/14700419/alternates/BASE_16_9_W1400/1761810784000/gebaudeeinsturz-in-der-turkei.jpeg,,Nach einem Hauseinsturz nahe der türkischen Metropole Istanbul sind ein Elternpaar und zwei ihrer Kinder tot aus den Trümmern geborgen worden. Einzig eine Tochter der Familie habe den Einsturz überle… [+1735 chars],,Katastrophen: Haus in Türkei eingestürzt – Eltern und Kinder tot. In der Nähe von Istanbul stürzt ein Wohnhaus ein. Schnell ist klar: Unter den Trümmern liegt eine fünfköpfige Familie begraben. Trotz stundenlangem Einsatz kann nur ein Leben gerettet werden.,"Disasters: House collapsed in Türkiye – parents and children dead. A residential building collapses near Istanbul. It quickly becomes clear: a family of five is buried under the rubble. Despite hours of effort, only one life can be saved.","Clades: Domus in Türkiye concidit – parentes et liberi mortui sunt. Aedificium residentiale prope Istanbul concidit. Cito patet: familia quinque sub ruderibus sepelitur. Quamvis horae laboris, una tantum vita salvari potest.",2025-10-22 05:46:29+00:00
a960e57f2e73012cec3b1f2ada9ff5a8,2025-10-08T16:41:39Z,'Erdbeben',www.zeit.de,de,0.8,Erdbeben: Vor Portugal hat wohl der Untergang des Atlantiks begonnen,"Forscher verfolgen vielleicht gerade einen der rätselhaftesten Erdprozesse in Echtzeit: den Anfang vom Ende eines Ozeans. Erklärt er auch, was Lissabon 1755 zerstörte?",https://www.zeit.de/wissen/2025-10/erdbeben-atlantik-untergang-ozeane-zyklen-erde,https://img.zeit.de/wissen/2025-10/erdbeben-atlantik-untergang-ozeane-zyklen-erde-bild/wide__1300x731,,"Schließen
Artikelzusammenfassung
Der Atlantik schrumpft: Fachleute beobachten vor Portugal einen unerwarteten Prozess, der das Rätsel um das Erdbeben von Lissabon von 1755 lösen könnte. Ein Team um… [+763 chars]",,"Erdbeben: Vor Portugal hat wohl der Untergang des Atlantiks begonnen. Forscher verfolgen vielleicht gerade einen der rätselhaftesten Erdprozesse in Echtzeit: den Anfang vom Ende eines Ozeans. Erklärt er auch, was Lissabon 1755 zerstörte?",Earthquake: The sinking of the Atlantic probably began off Portugal. Researchers may be tracking one of Earth's most puzzling processes in real time: the beginning of the end of an ocean. Does he also explain what destroyed Lisbon in 1755?,Terraemotus: Submersio Atlantici Portugalliae off probabiliter coepit. Investigatores possunt sequi unum processuum maxime perplexum Telluris in tempore reali: initium finis oceani. Etiamne explicat quid anno 1755 Olisiponense deperditum sit?,2025-10-22 05:46:29+00:00
4b21f2747f77a4d25d4003b3bff30749,2025-10-10T06:05:08Z,'Erdbeben Schäden',www.zeit.de,de,0.8,Naturkatastrophe : Philippinen erneut von starkem Beben erschüttert,"Auf den Philippinen hat ein erneutes Beben der Stärke 7,4 Teile des Landes getroffen. Eine Tsunami-Warnung wurde zunächst ausgegeben, später jedoch wieder aufgehoben.",https://www.zeit.de/gesellschaft/zeitgeschehen/2025-10/philippinen-erdbeben-naturkatastrophe-tsunami,https://img.zeit.de/gesellschaft/2025-10/starkes-erdbeben-auf-philippinen-bild/wide__1300x731,http://web.archive.org/web/20251010060756/https://www.zeit.de/gesellschaft/zeitgeschehen/2025-10/philippinen-erdbeben-naturkatastrophe-tsunami,Nur wenige Tage nach dem letzten schweren Erdbeben hat erneut ein starkes Beben die Philippinen erschüttert. Die US-Erdbebenwarte USGS stufte die Erschütterung am Morgen (Ortszeit) mit einer Stärke v… [+2717 chars],,"Naturkatastrophe : Philippinen erneut von starkem Beben erschüttert. Auf den Philippinen hat ein erneutes Beben der Stärke 7,4 Teile des Landes getroffen. Eine Tsunami-Warnung wurde zunächst ausgegeben, später jedoch wieder aufgehoben.","Natural disaster: Philippines shaken again by strong earthquake. In the Philippines, another earthquake with a magnitude of 7.4 hit parts of the country. A tsunami warning was initially issued but was later lifted.","Naturalis clades: Philippinae iterum terrae motu vehementi concussae. In Philippinis, alius terrae motus cum magnitudine 7.4 partium regionis hit. Monitum tsunami initio editum est sed postea sublatum est.",2025-10-22 05:46:29+00:00
37321cdc2705e401b65ea88497798a46,2025-10-10T06:55:45Z,'Erdbeben',www.stern.de,de,0.8,Zerstörerisches Beben,"Bei einem schweren Erdbeben der Stärke 7,4 auf den Philippinen ist mindestens ein Mensch ums Leben gekommen. Das Bild zeigt ein beschädigtes Einkaufszentrum in der Stadt Butuan.",https://www.stern.de/news/zerstoererisches-beben-36120042.html,https://image.stern.de/36120044/t/bA/v1/w1440/r1.7778/-/10--zerstoererisches-beben---8bad72e2af7f0861.jpg,,"Zugang zu stern+statt 11,96 
 nur 1  
<ul><li>Alles von stern+ mit erstklassigen Inhalten von GEO und Capital</li><li>4 Wochen testen, dann 2,99  je Woche</li><li>jederzeit kündbar</li></ul>",,"Zerstörerisches Beben. Bei einem schweren Erdbeben der Stärke 7,4 auf den Philippinen ist mindestens ein Mensch ums Leben gekommen. Das Bild zeigt ein beschädigtes Einkaufszentrum in der Stadt Butuan.",Destructive quake. At least one person has died in a massive 7.4 magnitude earthquake in the Philippines. The picture shows a damaged shopping mall in Butuan city.,Perdita quate. Saltem unus homo in ingenti 7.4 magnitudine terrae motus in Philippinis mortuus est. Pictura ostendit laesum shopping mall in urbe Butuan.,2025-10-22 05:46:29+00:00
42f34ee234050b56536ea98fe3c1ddc6,2025-10-10T10:49:33Z,'Erdbeben',www.stern.de,de,0.8,Mindestens sechs Tote nach schwerem Erdbeben im Süden der Philippinen,"Bei einem schweren Erdbeben der Stärke 7,4 auf den Philippinen sind am Freitag mindestens sechs Menschen ums Leben gekommen. Das Zentrum des Bebens lag nach Angaben der US-Erdbebenwarte USGS etwa 20 Kilometer vor der Küste von Manay auf der Insel Mindanao. Un…",https://www.stern.de/news/mindestens-sechs-tote-nach-schwerem-erdbeben-im-sueden-der-philippinen-36121264.html,https://image.stern.de/36121266/t/4m/v1/w1440/r1.7778/-/10--schaeden-an-einem-einkaufszentrum-in-butuan---230d5a76f00f9ac2.jpg,,"Kopiere den aktuellen Link
Zur Merkliste hinzufügen
Bei einem schweren Erdbeben der Stärke 7,4 auf den Philippinen sind am Freitag mindestens sechs Menschen ums Leben gekommen. Das Zentrum des Bebe… [+1974 chars]",,"Mindestens sechs Tote nach schwerem Erdbeben im Süden der Philippinen. Bei einem schweren Erdbeben der Stärke 7,4 auf den Philippinen sind am Freitag mindestens sechs Menschen ums Leben gekommen. Das Zentrum des Bebens lag nach Angaben der US-Erdbebenwarte USGS etwa 20 Kilometer vor der Küste von Manay auf der Insel Mindanao. Un…","At least six dead after massive earthquake in southern Philippines. At least six people were killed in a massive 7.4 magnitude earthquake in the Philippines on Friday. According to the US Earthquake Observatory USGS, the center of the quake was about 20 kilometers off the coast of Manay on the island of Mindanao. U.N…","Saltem sex mortui post ingens terrae motus in Philippinis meridionalibus. Saltem sex homines in ingenti 7.4 magnitudine terrae motus in Philippinis die Veneris occisi sunt. Secundum USGS terrae motus Observatorii USGS, centrum motus erat circiter XX chiliometrorum ab litore Manay in insula Mindanao. U.N...",2025-10-22 05:46:29+00:00
58a56700a8fd9cd52e7c12b064adf16d,2025-10-10T12:16:35Z,'Erdbeben',www.faz.net,de,0.8,Philippinen: Abermals Erdbeben und Tsunami-Warnung,"Zweimal an einem Tag erschüttern schwere Erdbeben die Philippinen, abermals gibt es eine Tsunami-Warnung: Die Zahl der Toten steigt auf sechs. Das Land ist schlecht auf Katastrophen vorbereitet.",https://www.faz.net/aktuell/gesellschaft/ungluecke/staerke-6-9-wieder-starkes-beben-auf-den-philippinen-accg-110725490.html,https://media0.faz.net/ppmedia/w1200/aktuell/gesellschaft/717819579/1.10725492/facebook_teaser/krankenwagen-sind-in.jpg.webp,,"Nur etwas mehr als eine Woche nach einem starken Erdbeben im Zentrum der Philippinen wurde das Land abermals von heftigen Erdstößen erschüttert. Zunächst gab es ein Erdbeben, das der US-Erdbebenwarte… [+2857 chars]",,"Philippinen: Abermals Erdbeben und Tsunami-Warnung. Zweimal an einem Tag erschüttern schwere Erdbeben die Philippinen, abermals gibt es eine Tsunami-Warnung: Die Zahl der Toten steigt auf sechs. Das Land ist schlecht auf Katastrophen vorbereitet.","Philippines: Another earthquake and tsunami warning. Severe earthquakes hit the Philippines twice in one day, and there was another tsunami warning: the death toll rose to six. The country is ill-prepared for disasters.","Philippinae: Alius terrae motus et tsunami admonitio. Gravibus terrae motibus bis in uno die Philippinas feriunt, et alius tsunami monitus fuit: thelonei mortis ad sex surrexit. Patria calamitatibus male paratur.",2025-10-22 05:46:29+00:00
c66aea4e8a3f73fab1dc350b95df9ca8,2025-10-10T13:08:24Z,'Erdbeben',www.diepresse.com,de,0.8,Weiteres Erdbeben auf Philippinen: Tsunamiwellen erwartet,"Bei dem ersten schweren Erdbeben sind mindestens vier Menschen gestorben. Nur wenige Stunden später erschütterte ein weiteres, fast genauso schweres Beben dieselbe Region. Tsunamiwellen könnten in den nächsten zwei Stunden eintreffen.",https://www.diepresse.com/20191485/weiteres-erdbeben-auf-philippinen-tsunamiwellen-erwartet,https://img.diepresse.com/public/incoming/p3g1l2-AFP_78CM9CQ.jpg/alternates/DPR_SOCIAL_NACHRICHTEN/AFP_78CM9CQ.jpg,,"Bei dem ersten schweren Erdbeben sind mindestens vier Menschen gestorben. Nur wenige Stunden später erschütterte ein weiteres, fast genauso schweres Beben dieselbe Region. Tsunamiwellen könnten in de… [+3277 chars]",,"Weiteres Erdbeben auf Philippinen: Tsunamiwellen erwartet. Bei dem ersten schweren Erdbeben sind mindestens vier Menschen gestorben. Nur wenige Stunden später erschütterte ein weiteres, fast genauso schweres Beben dieselbe Region. Tsunamiwellen könnten in den nächsten zwei Stunden eintreffen.","Another earthquake in the Philippines: tsunami waves expected. At least four people died in the first major earthquake. Just a few hours later, another earthquake, almost as powerful, shook the same region. Tsunami waves could arrive in the next two hours.","Alius terrae motus in Philippinis: tsunami undas expectat. Saltem quattuor homines in primo maiore terrae motu mortui sunt. Paucis post horis, alius terrae motus, quasi potens, eandem regionem concussit. Fluctus Tsunami in proximos duas horas pervenire potuit.",2025-10-22 05:46:29+00:00
8ea120800a75543559cf8b379b3dc0c5,2025-10-11T07:24:14Z,'Erdbeben Tote',www.zeit.de,de,0.8,Naturkatastrophe: Sieben Tote nach Erdbeben auf den Philippinen,Hier finden Sie Informationen zu dem Thema „Naturkatastrophe“. Lesen Sie jetzt „Sieben Tote nach Erdbeben auf den Philippinen“.,https://www.zeit.de/news/2025-10/11/sieben-tote-nach-erdbeben-auf-den-philippinen,https://img.zeit.de/news/2025-10/11/sieben-tote-nach-erdbeben-auf-den-philippinen-image-group/wide__1300x731,,"Die Zahl der Toten nach zwei schweren Erdbeben im Süden der Philippinen ist auf mindestens sieben gestiegen. Zudem seien mehr als 300 Menschen verletzt worden, teilten der Katastrophenschutz und örtl… [+1018 chars]",,Naturkatastrophe: Sieben Tote nach Erdbeben auf den Philippinen. Hier finden Sie Informationen zu dem Thema „Naturkatastrophe“. Lesen Sie jetzt „Sieben Tote nach Erdbeben auf den Philippinen“.,Natural disaster: Seven dead after earthquake in the Philippines. Here you will find information on the topic of “natural disasters”. Now read “Seven dead after earthquake in the Philippines”.,"Clades naturalis: Septem mortui post terrae motum in Philippinis. Hic informationes invenies in argumento ""clades naturales"". Nunc legitur ""Septem mortuos post terrae motum in Philippinis"".",2025-10-22 05:46:29+00:00
adc58e8aaaeb2fb77b42cd21abe757ee,2025-10-11T07:24:14Z,'Erdbeben Tote',www.stern.de,de,0.8,Naturkatastrophe: Sieben Tote nach Erdbeben auf den Philippinen,Manila - Die Zahl der Toten nach zwei schweren Erdbeben im Süden der Philippinen ist auf mindestens sieben gestiegen. Zudem seien mehr als 300 Menschen,https://www.stern.de/panorama/naturkatastrophe--sieben-tote-nach-erdbeben-auf-den-philippinen-36123046.html,https://image.stern.de/36123048/t/7F/v1/w1440/r1.7778/-/11--oa3ndusysgv2axs2048jpeg---04683c4b64b3be73.jpg,,"Kopiere den aktuellen Link
Zur Merkliste hinzufügen
Rettungsteams arbeiten sich durch das betroffene Gebiet, wo die Menschen immer wieder von weiteren Erschütterungen aufgeschreckt werden.
Die Zah… [+1170 chars]",,Naturkatastrophe: Sieben Tote nach Erdbeben auf den Philippinen. Manila - Die Zahl der Toten nach zwei schweren Erdbeben im Süden der Philippinen ist auf mindestens sieben gestiegen. Zudem seien mehr als 300 Menschen,Natural disaster: Seven dead after earthquake in the Philippines. Manila - The death toll after two severe earthquakes in the southern Philippines has risen to at least seven. There are also more than 300 people,Clades naturalis: Septem mortui post terrae motum in Philippinis. Manila - Mortuus vectigal post duos graves terrae motus in Philippinis australibus saltem septem orta est. Sunt etiam plus quam trecenti homines,2025-10-22 05:46:29+00:00
cfa8a957fa88394ff8c85149a285d43b,2025-10-11T07:25:15Z,'Erdbeben',www.tagesspiegel.de,de,0.8,Naturkatastrophe: Sieben Tote nach Erdbeben auf den Philippinen,"Rettungsteams arbeiten sich durch das betroffene Gebiet, wo die Menschen immer wieder von weiteren Erschütterungen aufgeschreckt werden.",https://www.tagesspiegel.de/gesellschaft/panorama/naturkatastrophe-sieben-tote-nach-erdbeben-auf-den-philippinen-14537168.html,https://www.tagesspiegel.de/images/14537165/alternates/BASE_16_9_W1400/1760167514000/erdbeben-auf-philippinen.jpeg,,"Die Zahl der Toten nach zwei schweren Erdbeben im Süden der Philippinen ist auf mindestens sieben gestiegen. Zudem seien mehr als 300 Menschen verletzt worden, teilten der Katastrophenschutz und örtl… [+1074 chars]",,"Naturkatastrophe: Sieben Tote nach Erdbeben auf den Philippinen. Rettungsteams arbeiten sich durch das betroffene Gebiet, wo die Menschen immer wieder von weiteren Erschütterungen aufgeschreckt werden.","Natural disaster: Seven dead after earthquake in the Philippines. Rescue teams are working their way through the affected area, where people are repeatedly startled by further tremors.","Clades naturalis: Septem mortui post terrae motum in Philippinis. Libera iugis per area affectata laborant, ubi homines ab ulterioribus tremoribus saepe commoti sunt.",2025-10-22 05:46:29+00:00
2500014ee5dd14fb612373ed5369eaba,2025-10-11T08:22:34Z,'Erdbeben',www.diepresse.com,de,0.8,Mindestens sieben Tote nach Erdbeben auf den Philippinen,Mehr als 300 Menschen wurden bei den zwei aufeinanderfolgenden Beben verletzt. Von den Folgen sind 200.000 Bewohner der Provinz Davao Oriental betroffen.,https://www.diepresse.com/20193120/mindestens-sieben-tote-nach-erdbeben-auf-den-philippinen,https://img.diepresse.com/public/incoming/vt9576-PHILIPPINES-QUAKE/alternates/DPR_SOCIAL_NACHRICHTEN/PHILIPPINES-QUAKE,,"Mehr als 300 Menschen wurden bei den zwei aufeinanderfolgenden Beben verletzt. Von den Folgen sind 200.000 Bewohner der Provinz Davao Oriental betroffen.
Die Zahl der Toten nach zwei schweren Erdbeb… [+1180 chars]",,Mindestens sieben Tote nach Erdbeben auf den Philippinen. Mehr als 300 Menschen wurden bei den zwei aufeinanderfolgenden Beben verletzt. Von den Folgen sind 200.000 Bewohner der Provinz Davao Oriental betroffen.,"At least seven dead after earthquake in Philippines. More than 300 people were injured in the two consecutive quakes. The consequences affect 200,000 residents of Davao Oriental Province.",Saltem septem mortui sunt post terrae motum in Philippinis. Plus quam trecenti homines in duobus motibus continuis laesi sunt. Consequentiae 200.000 incolarum Davao Provinciae Orientalis afficiunt.,2025-10-22 05:46:29+00:00
9c4b388be355adf9404b2a9b071587b1,2025-10-13T14:09:35Z,'Erdbeben Epizentrum',www.diepresse.com,de,0.8,Spürbares Erdbeben nördlich von Leoben,"In der Obersteiermark hat am Montagnachmittag ein Erdbeben der Stärke 2,6 die Region nördlich von Leoben erschüttert. Der Erdstoß war deutlich spürbar, Schäden wurden keine gemeldet.",https://www.diepresse.com/20201767/spuerbares-erdbeben-noerdlich-von-leoben,https://img.diepresse.com/public/incoming/jnzb95-imago-images-0773625716/alternates/DPR_SOCIAL_NACHRICHTEN/imago%20images%200773625716,,"In der Obersteiermark hat am Montagnachmittag ein Erdbeben der Stärke 2,6 die Region nördlich von Leoben erschüttert. Der Erdstoß war deutlich spürbar, Schäden wurden keine gemeldet.
Nördlich von Le… [+737 chars]",,"Spürbares Erdbeben nördlich von Leoben. In der Obersteiermark hat am Montagnachmittag ein Erdbeben der Stärke 2,6 die Region nördlich von Leoben erschüttert. Der Erdstoß war deutlich spürbar, Schäden wurden keine gemeldet.","Noticeable earthquake north of Leoben. In Upper Styria, an earthquake with a magnitude of 2.6 shook the region north of Leoben on Monday afternoon. The tremor was clearly noticeable and no damage was reported.","Terrae motus notabilis Leobeniensis septentrionalis. In Styria Superiore, terrae motus magnitudine 2.6 concussit regionem Leobeniensis septentrionalem die Lunae post meridiem. Tremor plane notabilis erat et nulla laesio relata est.",2025-10-22 05:46:29+00:00
33fd7fda8c7690a352eab54a1bc208b7,2025-10-13T14:46:16Z,'Erdbeben Epizentrum',steiermark.orf.at,de,0.8,Erdbeben nahe von Leoben registriert,"Nördlich von Leoben hat am Montagnachmittag die Erde spürbar gebebt. Der Erdstoß mit der Magnitude 2,6 wurde laut GeoSphere Austria um 15.16 Uhr von der Bevölkerung im Epizentrum deutlich verspürt.",https://steiermark.orf.at/stories/3325693/,https://ibs.orf.at/stm?image=https%3A%2F%2Foekastatic.orf.at%2Fmims%2F2025%2F42%2F88%2Fcrops%2Fw%3D1200%2Ch%3D627%2Cq%3D75%2F2798258_master_1079588_wf_evid53232006.png%3Fs%3Da35b497907ad11ba2b19c47e5788139dc58c4a1b,,"Gegenstände bewegten sich leicht, auch Grollen wurde vernommen. Schäden seien bei dieser Stärke aber nicht zu erwarten. Das Epizentrum lag vier Kilometer nordnordwestlich von Leoben, 47 Kilometer von… [+467 chars]",,"Erdbeben nahe von Leoben registriert. Nördlich von Leoben hat am Montagnachmittag die Erde spürbar gebebt. Der Erdstoß mit der Magnitude 2,6 wurde laut GeoSphere Austria um 15.16 Uhr von der Bevölkerung im Epizentrum deutlich verspürt.","Earthquake registered near Leoben. The earth shook noticeably north of Leoben on Monday afternoon. According to GeoSphere Austria, the earthquake with a magnitude of 2.6 was clearly felt by the population in the epicenter at 3:16 p.m.","Terrae motus descripserunt prope Leoben. Terra de Leobeno septentrionali die Lunae post meridiem conspicue concussa est. Secundum GeoSphere Austriam, terrae motus cum magnitudine 2.6 manifesto sensit ab multitudine in epicenter ad 3:16 a.m.",2025-10-22 05:46:29+00:00
31dedf6efe596bed2fd19204274c9b1c,2025-10-15T00:00:00Z,'Erdbeben',www.jw.org,de,0.8,NACHRICHTEN | Schweres Erdbeben erschüttert die Philippinen,,https://www.jw.org/de/nachrichten/region/philippinen/Schweres-Erdbeben-ersch%C3%BCttert-die-Philippinen/,https://cms-imgp.jw-cdn.org/img/p/702025159/univ/art/702025159_univ_lsr_lg.jpg,,"Am 30. September 2025 erschütterte ein Erdbeben der Stärke 6,9 die Küstenstadt Bogo im Norden der philippinischen Provinz Cebu. Das Erdbeben ereignete sich nur wenige Tage, nachdem ein Taifun im Oste… [+1211 chars]",,NACHRICHTEN | Schweres Erdbeben erschüttert die Philippinen. nan,NEWS | Strong earthquake shakes the Philippines. nan,NEWS | Magnus terrae motus Philippinas quatit. nan,2025-10-22 05:46:29+00:00
f07b3447f8bc3d2b6d6a9d21dde1a412,2025-10-27T20:38:16Z,'Erdbeben',orf.at,de,0.8,"Erdbeben der Stärke 6,1 erschüttert Westtürkei",,https://orf.at/stories/3409743/,https://orf.at/mojo/1_4_1/storyserver//news/common/images/og-fallback-news.png,,"Ein Erdbeben der Stärke 6,1 hat die Westtürkei erschüttert. Nach Angaben der Katastrophenschutzbehörde Afad befand sich das Epizentrum im Bezirk Sindirgi der westtürkischen Provinz Balikesir.
Das Be… [+651 chars]",,"Erdbeben der Stärke 6,1 erschüttert Westtürkei. nan",Magnitude 6.1 earthquake shakes western Turkey. nan,Magnitudo 6.1 terrae motus Turcia occidentalis quatit. nan,2025-10-22 05:46:29+00:00
02b3b3b8498455361e4a394eedf326f7,2025-10-27T20:56:15Z,'Erdbeben',www.diepresse.com,de,0.8,"Erdbeben der Stärke 6,1 erschüttert Westtürkei","Das Beben habe sich um 22.48 Uhr in einer Tiefe von 5,99 Kilometern ereignet.",https://www.diepresse.com/20250000/erdbeben-der-staerke-6-1-erschuettert-westtuerkei,https://www.diepresse.com/assets_v2/images/diepresse_nachrichten.png,,"Das Beben habe sich um 22.48 Uhr in einer Tiefe von 5,99 Kilometern ereignet.
Ein Erdbeben der Stärke 6,1 hat die Westtürkei erschüttert. Nach Angaben der Katastrophenschutzbehörde Afad befand sich … [+1009 chars]",,"Erdbeben der Stärke 6,1 erschüttert Westtürkei. Das Beben habe sich um 22.48 Uhr in einer Tiefe von 5,99 Kilometern ereignet.",Magnitude 6.1 earthquake shakes western Turkey. The quake occurred at 10:48 p.m. at a depth of 5.99 kilometers.,Magnitudo 6.1 terrae motus Turcia occidentalis quatit. Commotio incidit in 10:48 a.m. in altitudinem 5.99 chiliometrorum.,2025-10-22 05:46:29+00:00
64cb424b6cd60c476d6dc35854575021,2025-10-28T07:03:32Z,'Erdbeben',www.morgenpost.de,de,0.8,"Mit Stärke 6,1: Schweres Erdbeben erschüttert die Türkei",Viele Gebiete in der Türkei sind stark erdbebengefährdet. Nun bebt in der Westtürkei die Erde. Die Region wird immer wieder erschüttert.,https://www.morgenpost.de/panorama/article410322232/mit-staerke-61-schweres-erdbeben-erschuettert-die-tuerkei.html,https://img.sparknews.funkemedien.de/410322258/410322258_1761634800_v16_9_1600.jpeg,,"Ein Erdbeben der Stärke 6,1 hat den Westen der Türkei erschüttert. Nach Angaben der Katastrophenschutzbehörde Afad befand sich das Epizentrum im Bezirk Sindirgi der westtürkischen Provinz Balikesir. … [+1106 chars]",,"Mit Stärke 6,1: Schweres Erdbeben erschüttert die Türkei. Viele Gebiete in der Türkei sind stark erdbebengefährdet. Nun bebt in der Westtürkei die Erde. Die Region wird immer wieder erschüttert.",With a magnitude of 6.1: Severe earthquake shakes Turkey. Many areas in Turkey are at high risk of earthquakes. Now the earth is shaking in western Turkey. The region is repeatedly shaken.,Cum magnitudine 6.1: Gravis terrae motus Turciam commovet. Multae areas in Turcia in magno periculo motuum sunt. Nunc terra in Turcia occidentali quatitur. Regione saepe quatitur.,2025-10-22 05:46:29+00:00
